trip_start_time,author_id,trip_path_detail,trip_end_time,trip_path_city
28 Nov 2013,5294d05be70545ca1a000000,"[[u'Edinburgh Dungeon', u'The Scott Monument', u'National Museum Of Scotland', u'Edinburgh Castle'], [u'Queens House', u'The Monument', u'Tower Of London', u'Big Ben London', u'Buckingham Palace London', u'The London Eye']]",29 Nov 2013,"Edinburgh,London"
28 Nov 2013,5294d05be70545ca1a000000,"[[u'Edinburgh Dungeon', u'The Scott Monument', u'National Museum Of Scotland', u'Edinburgh Castle'], [u'Queens House', u'The Monument', u'Tower Of London', u'Big Ben London', u'Buckingham Palace London', u'The London Eye']]",29 Nov 2013,"Edinburgh,London"
18 Feb 2016,56c5b254dd853aff0900085c,"[[u'Green Park', u'Bond Street Station', u'Oxford Street']]",08 Mar 2016,London
22 Apr 2015,,"[[u'Big Ben London', u'The London Eye'], [u'Madame Tussauds Museum', u'Tower Of London']]",08 May 2015,"London,London"
20 Jun 2015,,"[[u'Big Ben London', u'Tower Bridge', u'Hampton Court Palace'], [u'Stegastein Viewpoint', u'The Flam Railway', u'Njord - Seakayak And Wilderness Adventure Day Tours', u'Fjord Safari']]",21 Jun 2015,"London,Flam"
01 Mar 2014,,"[[u'Big Ben London', u'The London Eye', u'London Aquarium', u'Tower Bridge'], [u'Natural History Museum', u'Madame Tussauds Museum', u'Tate Modern']]",10 Mar 2014,"London,London"
06 Jul 2015,,"[[u'Library Of Birmingham', u'Symphony Hall', u'Cadbury World'], [u'Birmingham Museum And Art Gallery', u'Birmingham Hippodrome'], [u'National Motorcycle Museum', u'Thinktank Science Museum', u'National Sea Life Centre'], [u'National Exhibition Centre Nec', u'Baddesley Clinton', u'Birmingham Back To Backs', u'Town Hall Birmingham'], [u'Natural History Museum', u'Westminster Abbey', u'The London Eye', u'Science Museum - Corporate and Private Hire'], [u'National Gallery'], [u'British Museum', u'Madame Tussauds Museum'], [u'National Portrait Gallery', u'Harrods']]",13 Jul 2015,"Birmingham,Birmingham,Birmingham,Birmingham,London,London,London,London"
23 Aug 2014,,"[[u'Buckingham Palace London', u'Big Ben London', u'The London Eye'], [u'Tower Of London', u'National Gallery'], [u'Natural History Museum', u'British Museum'], [u'Westminster Abbey', u'Tate Modern', u'Trafalgar Square'], [u'The London Dungeon', u'Palace Of Westminster', u'Tower Bridge'], [u'London Aquarium', u'London Transport Museum', u'Greenwich Park', u'Tate Museum']]",28 Aug 2014,"London,London,London,London,London,London"
30 May 2016,,"[[u'Trafalgar Square', u'Westminster Abbey', u'National Gallery'], [u'Palace Of Westminster', u'Big Ben London', u'London Transport Museum', u'Churchill War Rooms'], [u'Doges Palace', u'Grand Canal', u'Saint Marks Basilica', u'Peggy Guggenheim Collection', u'Church Of San Giorgio Maggiore'], [u'Rialto Bridge', u'Cannaregio', u'Interpreti Veneziani', u'The Phoenix Theatre', u'St. Marks Clocktower'], [u'The Palais Royal', u'Grand Palais', u'Towers Of Notre Dame Cathedral', u'Champ De Mars'], [u'Disneyland', u'Palais De Chaillot', u'Musee Du Quai Branly', u'National Library'], [u'Roman Forum', u'Basilica Santa Maria Degli Angeli E Dei Martiri', u'Colosseum', u'Monte Palatino'], [u'Lindenhof', u'Old Town'], [u'Notre Dame Du Sablon', u'Autoworld', u'Cathedrale St-michel Et Ste-gudule', u'Grand Place', u'Galeries Royales Saint-hubert'], [u'Stephansplatz', u'Karlskirche', u'Wiener Riesenrad', u'Vienna State Opera'], [u'Sachsenhausen', u'The Main Tower', u'St Pauls Church', u'The Goethe House'], [u'Guinness Storehouse', u'Temple Bar Company', u'National Gallery Of Ireland', u'Wynns Hotel Dublin']]",10 Jun 2016,"London,London,Venice,Venice,Paris,Paris,Rome,Zurich,Brussels,Vienna,Frankfurt,Dublin"
13 Oct 2015,5524cfc0fbc2e55c42001333,"[[u'Covent Garden', u'British Museum'], [u'National Gallery'], [u'Harrods', u'Natural History Museum', u'The Monument']]",15 Oct 2015,"London,London,London"
24 Jun 2014,53aa09ace70545b67f000017,"[[u'Natural History Museum', u'Westminster Abbey', u'Buckingham Palace London', u'British Museum', u'Big Ben London', u'The London Eye'], [u'Trafalgar Square', u'London Transport Museum', u'Tower Bridge']]",25 Jun 2014,"London,London"
14 Sep 2015,,"[[u'Natural History Museum', u'Tower Bridge', u'Big Ben London', u'Portobello Market'], [u'St Pauls Cathedral', u'Kensington Palace', u'The London Eye', u'Regents Park'], [u'Suleymaniye Mosque', u'Sultan Ahmed Mosque', u'Topkapi Palace'], [u'Hagia Sophia', u'Spice Bazar', u'Istanbul Archaeological Museum', u'Istanbul Dolphinarium'], [u'Dolmabahce Palace', u'Turkish And Islamic Arts Museum', u'Grand Bazaar', u'Ortakoy'], [u'Dubai Miracle Garden', u'Wild Wadi Water Park', u'Dubai Museum'], [u'Dolphin Bay', u'Saeed Al Maktoum House', u'The Dubai Mall'], [u'Dubai Moving Image Museum', u'The Dubai Mall Aquarium', u'The Dubai Fountain', u'Dhow Cruise']]",21 Sep 2015,"London,London,Istanbul,Istanbul,Istanbul,Dubai,Dubai,Dubai"
15 Sep 2016,,"[[u'Crystal Palace Park', u'The London Eye', u'Buckingham Palace London', u'Queen Elizabeth Olympic Park', u'Cleopatras Needle']]",30 Sep 2016,London
03 Aug 2014,5304fd38e705454602000000,"[[u'Big Ben London', u'The London Eye', u'Buckingham Palace London'], [u'Natural History Museum', u'National Gallery'], [u'Tower Of London', u'British Museum'], [u'Westminster Abbey', u'Piccadilly Circus', u'Tate Modern']]",06 Aug 2014,"London,London,London,London"
25 Dec 2015,,"[[u'The Royal Horseguards', u'Churchill War Rooms', u'Tower Of London', u'Natural History Museum'], [u'The Royal Horseguards'], [u'The Royal Horseguards'], [u'The Royal Horseguards'], [u'The Royal Horseguards'], [u'The Royal Horseguards'], [u'The Royal Horseguards']]",31 Dec 2015,"London, , , , , , "
22 Feb 2015,,"[[u'Big Ben London', u'Buckingham Palace London', u'The London Eye', u'Madame Tussauds Museum'], [u'Piccadilly Circus', u'Westminster Abbey', u'Harrods']]",23 Feb 2015,"London,London"
27 Apr 2016,56821b7cf8853a5b0b000061,"[[u'Big Ben London', u'The London Dungeon', u'Buckingham Palace London'], [u'Portobello Market', u'The London Eye', u'Churchill War Rooms'], [u'National Maritime Museum', u'London Aquarium', u'Barbecoa', u'The View From The Shard'], [u'Tower Of London', u'Harrods'], [u'Rijksmuseum', u'Vondelpark', u'Stedelijk Museum', u'Golden Tulip Amsterdam West'], [u'Van Gogh Museum', u'Leidseplein', u'Amsterdam Centraal Railway Station'], [u'Basilica Of The Holy Blood', u'Begijnhof Or Beguinage', u'The Markt', u'Historium Brugge'], [u'Autoworld', u'Notre Dame Du Sablon', u'Cathedrale St-michel Et Ste-gudule', u'Grand Place', u'Galeries Royales Saint-hubert'], [u'The Palais Royal', u'Grand Palais', u'Towers Of Notre Dame Cathedral', u'Champ De Mars'], [u'Disneyland']]",06 May 2016,"London,London,London,London,Amsterdam,Amsterdam,Bruges,Brussels,Paris,Paris"
08 Mar 2015,54f5fb19fbc2e5aa3a000547,"[[u'Madame Tussauds Museum', u'Big Ben London', u'Buckingham Palace London', u'Oxford Street'], [u'Westminster Abbey', u'Harrods', u'The London Eye']]",09 Mar 2015,"London,London"
26 Nov 2014,5465fa5ee70545da1d000187,"[[u'Big Ben London', u'The London Eye', u'Tower Of London']]",26 Nov 2014,London
15 Mar 2015,54fdd8110c1d0ad53d0000eb,"[[u'Madame Tussauds Museum', u'Oxford Street', u'Buckingham Palace London', u'Big Ben London'], [u'Westminster Abbey', u'The London Eye', u'Harrods']]",16 Mar 2015,"London,London"
29 Sep 2015,,"[[u'Torc Waterfall', u'Ballyseedy Memorial', u'Kirbys Brogue Inn', u'The Kerry Way', u'Aghadoe Cathedral'], [u'Ballyseedy Woods', u'Muckross House', u'Ross Castle', u'Wild Kerry Day Tours', u'Bin Ban Gallery'], [u'King Johns Castle', u'Flannerys Bar', u'Frank Mccourt Museum', u'Limerick City Walking Tour'], [u'St Marys Cathedral', u'Mill Market', u'Thomond Park', u'Angelas Shes Walking Tour'], [u'Scottish Mining Museum', u'Glasgow Botanical Gardens', u'Arniston House', u'Royal Yacht Britannia'], [u'Stirling Castle', u'Edinburgh Zoo', u'Edinburgh Dungeon', u'Our Dynamic Earth'], [u'Pulteney Bridge', u'Sally Lunns Historic Museum And Eating House', u'Roman Baths Museum', u'Holburne Museum', u'The Jane Austen Centre'], [u'Grand Pump Room', u'Prior Park', u'Bath Abbey', u'Haynes International Motor Museum', u'Theatre Royal Bath'], [u'Buckingham Palace London', u'The London Eye', u'Harrods'], [u'Westminster Abbey', u'Madame Tussauds Museum', u'Tower Bridge', u'Big Ben London'], [u'Van Gogh Museum', u'Vondelpark', u'Bloemenmarkt', u'Anne Frank House', u'Sexmuseum'], [u'Royal Palace', u'Jordaan', u'Begijnhof', u'Stedelijk Museum', u'Concertgebouw'], [u'Bamberg Cathedral', u'Natural History Museum', u'Altes Rathaus', u'Jazzclub Bamberg E.v.', u'Stephanskirche'], [u'E. T. A. Hoffmann Haus', u'St Michael\\s Monastery', u'Diocesan Museum', u'Alte Hofhaltung', u'Klein Venedig'], [u'Landesmuseum', u'St Peters Church', u'Bahnhofstrasse', u'Kunsthaus'], [u'Cathedral At Munsterplatz', u'Central Railroad Station', u'Zytglogge'], [u'Palazzo Vecchio', u'Bargello Museum And Palace', u'Basilica Di Santa Maria Del Fiore', u'Ponte Vecchio'], [u'Market Square', u'Le Vie Della Bellezza', u'Museo Tecnico Navale']]",16 Oct 2015,"[[u'Tralee', u'Killarney'], [u'Tralee', u'Killarney'], u'Limerick', u'Limerick', [u'Edinburgh', u'Glasgow'], u'Edinburgh', u'Bath', u'Bath', u'London', u'London', u'Amsterdam', u'Amsterdam', u'Bamberg', u'Bamberg', u'Zurich', u'Bern', u'Florence', u'La Spezia']"
29 Dec 2013,52becf54e705454c3d000000,"[[u'Big Ben London', u'Tower Of London', u'National Gallery', u'Piccadilly Circus']]",03 Jan 2014,London
01 Mar 2014,,"[[u'Natural History Museum', u'National Gallery', u'Madame Tussauds Museum'], [u'Tate Modern', u'Canary Wharf', u'The Monument']]",10 Mar 2014,"London,London"
30 Jul 2016,,"[[u'The London Eye', u'Buckingham Palace London', u'Victoria And Albert Museum', u'Park Plaza Riverbank'], [u'Guinness Storehouse', u'Phoenix Park'], [u'Sexmuseum', u'Huis Marseille, Museum For Photography', u'Rijksmuseum', u'Elandsgracht'], [u'Van Gogh Museum', u'Natura Artis Magistra', u'Prinsengracht'], [u'Karlsplatz', u'Cathedral Of Our Lady', u'Marienplatz', u'Dachau Concentration Camp', u'Viktualienmarkt'], [u'Lake Geneva', u'Place Des Nations', u'Geneva Flower Clock Or Horloge Fleurie', u'The Jet D Eau', u'P\xe2quis Centre'], [u'St Peters Cathedral', u'Place Du Bourg De Four', u'Museum Of Art And History', u'Place De Neuve', u'Palace Of Nations'], [u'Sforza Castle', u'Milan Cathedral Or The Duomo'], [u'Boboli Garden', u'Palazzo Vecchio', u'Piazza Della Signoria', u'Basilica Di Santa Maria Del Fiore'], [u'Roman Forum', u'Colosseum', u'Galleria Borghese', u'Monte Palatino'], [u'Acropolis', u'Parthenon', u'Temple Of Athena Nike'], [u'National Archaeological Museum', u'Acropolis Museum', u'Ancient Agora'], [u'Erechtheion', u'Temple Of Hephaestus', u'Temple Of Olympian Zeus'], [u'Panathenaic Stadium', u'Temple Of Apollo', u'Piraeus'], [u'Statue Of Liberty', u'National 9-11 Memorial Museum', u'Radio City Music Hall']]",13 Aug 2016,"London,Dublin,Amsterdam,Amsterdam,Munich,Geneva,Geneva,Milan,Florence,Rome,Athens,Athens,Athens,Athens,New York City"
06 Dec 2013,529e0d05e70545d164000000,"[[u'The London Dungeon', u'Trafalgar Square', u'Club Aquarium']]",06 Dec 2013,London
17 Mar 2015,55011f6efbc2e5e52e0009ca,"[[u'Madame Tussauds Museum', u'Oxford Street', u'Buckingham Palace London', u'Big Ben London'], [u'Westminster Abbey', u'The London Eye', u'Harrods']]",18 Mar 2015,"London,London"
08 Feb 2015,,"[[u'Big Ben London', u'Buckingham Palace London', u'The London Eye', u'Madame Tussauds Museum'], [u'Piccadilly Circus', u'Westminster Abbey', u'Harrods']]",09 Feb 2015,"London,London"
29 Apr 2016,,"[[u'Dijon Ville', u'London St. Pancras International', u'Tower Of London', u'Victoria And Albert Museum'], [u'The London Eye', u'Natural History Museum', u'Tower Bridge', u'Big Ben London'], [u'Madame Tussauds Museum', u'London St. Pancras International', u'Dijon Ville']]",01 May 2016,"London,London,London"
05 Nov 2014,5006cebb76a2954457000004,"[[u'Natural History Museum', u'The London Eye', u'Big Ben London'], [u'National Gallery', u'St Pauls Cathedral']]",06 Nov 2014,"London,London"
26 Nov 2014,5465c7f2e705453f4500001d,"[[u'Big Ben London', u'The London Eye', u'Tower Bridge', u'Trafalgar Square']]",26 Nov 2014,London
19 Jun 2014,5301d762e70545f578000000,"[[u'The London Eye', u'Buckingham Palace London', u'Big Ben London', u'Madame Tussauds Museum', u'Piccadilly Circus', u'The London Dungeon']]",22 Jun 2014,London
24 Jun 2015,,"[[u'Tower Bridge', u'Harrods', u'Canary Wharf'], [u'The London Dungeon', u'Madame Tussauds Museum', u'China Town']]",25 Jun 2015,"London,London"
23 Dec 2016,,"[[u'Big Ben London', u'Tower Bridge', u'Hampton Court Palace'], [u'Buckingham Palace London', u'British Museum'], [u'Churchill War Rooms', u'Zsl London Zoo', u'Victoria And Albert Museum'], [u'Holburne Museum', u'Bute Park', u'Thermae Bath Spa', u'Roman Baths Museum'], [u'National Museum And Art Gallery', u'Bath Abbey', u'Mermaid Quay', u'Theatre Royal Bath'], [u'Bristol Zoo Gardens', u'Oxford Covered Market', u'Cabot Circus', u'Ashton Court', u'The Jane Austen Centre'], [u'The Botanical Gardens', u'National Railway Museum', u'Tropical Butterfly House'], [u'Museum Of Science And Industry', u'The Shambles', u'Sheffield Winter Garden', u'Sheffield City Hall', u'Graves Park']]",30 Dec 2016,"[u'London', u'London', u'London', [u'Bath', u'Cardiff'], [u'Bath', u'Cardiff'], [u'Bath', u'Bristol', u'Oxford'], [u'York', u'Sheffield'], [u'York', u'Sheffield', u'Manchester']]"
29 Jan 2017,55380896fbc2e52637000b4e,"[[u'Trafalgar Square', u'British Museum'], [u'The Royal Botanic Kew Garden', u'Madame Tussauds Museum', u'China Town'], [u'The Monument', u'London Transport Museum', u'Harrods', u'St James Palace'], [u'National Gallery'], [u'Shakespeares Globe', u'Natural History Museum'], [u'National Portrait Gallery', u'Tate Modern', u'London Aquarium'], [u'Oxford Covered Market', u'Churchill War Rooms', u'Victoria And Albert Museum', u'Kensington Palace']]",04 Feb 2017,"[u'London', u'London', u'London', u'London', u'London', u'London', [u'London', u'Oxford']]"
20 Sep 2016,,[[u'British Museum']],09 Oct 2016,London
08 Oct 2014,53b8759fe70545cf4100001e,"[[u'Trafalgar Square', u'National Portrait Gallery', u'Big Ben London', u'Palace Of Westminster']]",08 Oct 2014,London
13 Jun 2016,56835dbe85e4822b38000780,"[[u'Natural History Museum', u'Madame Tussauds Museum', u'Westminster Abbey', u'Tower Bridge'], [u'Shreks Adventure', u'Piccadilly Circus', u'British Museum', u'Hyde Park'], [u'Zsl London Zoo', u'Leicester Square', u'10 Downing Street', u'Oxford Street'], [u'Chessington World Of Adventures'], [u'Thorpe Park']]",17 Jun 2016,"London,London,London,Chessington,London"
26 May 2014,537576fae705451408000000,"[[u'Big Ben London', u'The London Dungeon']]",14 Jun 2014,London
01 Jul 2016,56c1131c7647192b7c000076,"[[u'Shoreline Snuba', u'Hawaiian Paddle Sports', u'The Shops At Wailea'], [u'Ahihi-Kinau Natural Area Reserve', u'Wailea Beach', u'Makena Landing Park'], [u'Wailea Golf Club ', u'Keawakapu Beach '], [u'Spa Grande', u'Waihee Ridge Trail', u'Waianapanapa State Park'], [u'Kamaole Beach Park', u'Iao Valley State Park', u'Redline Rafting Co.'], [u'Galleria Borghese', u'Colosseum', u'Ruins Of The Palatine Hill', u'Fontana Dei Quattro Fiumi', u'Piazza Di San Pietro In Vincoli'], [u'Roman Forum', u'Basilica Santa Maria Degli Angeli E Dei Martiri', u'Pantheon', u'Piazza Di San Clemente'], [u'Piazzale Michelangelo', u'Boboli Garden', u'Palazzo Vecchio', u'Basilica Di Santa Maria Del Fiore'], [u'Ponte Vecchio', u'Accademia Gallery', u'Basilica Di Santa Croce And Pazzi Chapel', u'Museo Galileo'], [u'Sagrada Familia', u'Park Guell', u'Picasso Museum'], [u'Casa Mila', u'Joan Miro Foundation', u'Barcelona Aquarium'], [u'Munich Residenz', u'Marienplatz'], [u'Karlsplatz', u'Bmw Headquarters And Museum', u'The Alte Pinakothek', u'The Neue Pinakothek'], [u'Madame Tussauds Museum', u'Buckingham Palace London', u'Piccadilly Circus'], [u'National Gallery', u'The London Eye', u'London Aquarium']]",15 Jul 2016,"[[u'Maui', u'Wailea-makena'], u'Wailea-makena', u'Wailea-makena', [u'Maui', u'Wailea-makena'], [u'Kihei', u'Maui'], u'Rome', u'Rome', u'Florence', u'Florence', u'Barcelona', u'Barcelona', u'Munich', u'Munich', u'London', u'London']"
31 May 2015,556409e1fbc2e5c928000146,"[[u'Buckingham Palace London', u'Churchill War Rooms', u'Palace Of Westminster'], [u'Trafalgar Square', u'Tower Of London', u'London Aquarium']]",01 Jun 2015,"London,London"
16 Apr 2016,56cfd0b08527a5ac3d000430,"[[u'Tower Of London', u'The London Eye', u'Buckingham Palace London', u'Tower Bridge', u'Camden Lock Market', u'The View From The Shard', u'Oxford Street']]",18 Apr 2016,London
07 Apr 2015,551cfcf9fbc2e53526000a47,"[[u'Rijksmuseum', u'Anne Frank House', u'Heineken Experience', u'Amsterdam Canals'], [u'Trafalgar Square', u'Harrods', u'Buckingham Palace London']]",08 Apr 2015,"Amsterdam,London"
31 Mar 2015,,"[[u'Big Ben London', u'The London Eye', u'Piccadilly Circus'], [u'National Portrait Gallery', u'National Gallery', u'Natural History Museum']]",01 Apr 2015,"London,London"
13 Apr 2016,,"[[u'The Palais Royal', u'Grand Palais', u'Towers Of Notre Dame Cathedral', u'Champ De Mars'], [u'Disneyland', u'Palais De Chaillot', u'Musee Du Quai Branly', u'National Library'], [u'Central Market', u'Galleria Uomo Arte Antiquariato', u'Museo Dell\\opera Del Duomo', u'Leaning Tower Of Pisa', u'The Knights Square'], [u'Le Mura Di Lucca', u'Piazza Del Duomo', u'Guinigi Tower', u'Cathedral Of San Martino', u'Museo Degli Strumenti Per Il Calcolo'], [u'Sexmuseum', u'Huis Marseille, Museum For Photography', u'Rijksmuseum', u'Elandsgracht'], [u'Van Gogh Museum', u'Natura Artis Magistra', u'Prinsengracht'], [u'Sistine Chapel', u'Colosseum', u'Vatican Museums', u'Trevi Fountain'], [u'Autoworld', u'Notre Dame Du Sablon', u'Cathedrale St-michel Et Ste-gudule', u'Grand Place', u'Galeries Royales Saint-hubert'], [u'The London Eye', u'Buckingham Palace London', u'Victoria And Albert Museum', u'Park Plaza Riverbank'], [u'Lindenhof', u'Knies Kinderzoo', u'Polish Museum', u'Schloss Rapperswil']]",22 Apr 2016,"[u'Paris', u'Paris', [u'Pisa', u'Livorno'], [u'Pisa', u'Lucca'], u'Amsterdam', u'Amsterdam', [u'Rome', u'Vatican City', u'Vatican City'], u'Brussels', u'London', [u'Rapperswil', u'Zurich']]"
28 Apr 2014,,"[[u'Big Ben London', u'Natural History Museum', u'Westminster Abbey', u'Piccadilly Circus']]",28 Apr 2014,London
23 Jun 2014,539cbf20e70545e755000019,"[[u'Millennium Bridge', u'The Monument', u'Tower Bridge', u'Tower Of London', u'Royal Observatory Greenwich', u'Greenwich Park', u'Westminster Abbey']]",23 Jun 2014,London
08 Jan 2016,568f2756a6d46d71350010a9,"[[u'Oxford Street', u'Tower Bridge', u'Buckingham Palace London', u'The London Eye'], [u'Tower Of London', u'Big Ben London', u'Portobello Market'], [u'Grand Palais', u'Sacre Coeur Montmartrel', u'Towers Of Notre Dame Cathedral', u'Army Museum'], [u'Louvre Museum'], [u'Roman Forum', u'Colosseum', u'Trevi Fountain'], [u'St Peters Basilica', u'Vatican Museums'], [u'St Peters Basilica', u'Pantheon', u'Castle San Angelo', u'Ruins Of The Palatine Hill']]",14 Jan 2016,"[u'London', u'London', u'Paris', u'Paris', u'Rome', u'Rome', [u'Rome', u'Vatican City']]"
19 Jul 2015,558a43b7fbc2e5200d000b70,"[[u'Ras Al Khor Wildlife Sanctuary', u'Saeed Al Maktoum House', u'Dubai Moving Image Museum', u'Chinawhite'], [u'Camel Racing', u'Dubai Museum', u'Dhow Cruise'], [u'Oxford Street', u'Tower Bridge', u'Natural History Museum', u'Big Ben London'], [u'St Pauls Cathedral', u'Covent Garden', u'The London Eye', u'Kensington Palace'], [u'Monas', u'Indonesia Bank Museum', u'Istiqlal Mosque', u'Sea World']]",23 Jul 2015,"Dubai,Dubai,London,London,Jakarta"
13 Jan 2015,,"[[u'Buckingham Palace London', u'Tower Of London', u'The London Eye', u'Westminster Abbey', u'Trafalgar Square']]",14 Jan 2015,London
04 Jul 2016,,"[[u'Lindenhof', u'Old Town'], [u'Uetliberg', u'Wooden Bridge From Rapperswil To Hurden', u'Schloss Rapperswil', u'Lake Promenade'], [u'Schanzengraben', u'Bahnhofstrasse', u'Golf Now - Indoors', u'Liebfrauenkapelle'], [u'Tower Bridge', u'Buckingham Palace London', u'The London Eye', u'Covent Garden'], [u'British Museum', u'Big Ben London', u'London Aquarium'], [u'Caf\xe9 De Flore', u'La Defense', u'Palais De Chaillot', u'Arc De Triomphe'], [u'Towers Of Notre Dame Cathedral', u'Eiffel Tower', u'Pierre Herme', u'River Seine'], [u'Atomium And Mini Europe ', u'Notre Dame Du Sablon', u'Autoworld', u'Cathedrale St-michel Et Ste-gudule', u'Delirium Cafe'], [u'Parc De Bruxelles- National Day Celebration', u'Moof Museum', u'Tomorrowland', u'Galeries Royales Saint-hubert'], [u'Sagrada Familia', u'Park Guell', u'Castell De Montjuic'], [u'Camp Nou', u'Casa Mila', u'Barcelona Aquarium']]",14 Jul 2016,"[u'Zurich', [u'Rapperswil', u'Zurich'], [u'Rapperswil', u'Zurich'], u'London', u'London', u'Paris', u'Paris', u'Brussels', [u'Brussels', u'Boom'], u'Barcelona', u'Barcelona']"
28 Apr 2016,,"[[u'Natural History Museum', u'Big Ben London', u'The London Dungeon'], [u'Buckingham Palace London', u'Churchill War Rooms', u'The London Eye'], [u'British Museum', u'National Maritime Museum', u'Barbecoa'], [u'Tower Of London', u'Harrods', u'The View From The Shard'], [u'Rijksmuseum', u'Vondelpark', u'Stedelijk Museum', u'Golden Tulip Amsterdam West'], [u'Van Gogh Museum', u'Leidseplein', u'Oude Kerk', u'Albert Cuyp Market'], [u'Caf\xe9 De Flore', u'Palais De Chaillot', u'Catacombs Of Paris', u'Arc De Triomphe'], [u'Eiffel Tower', u'Towers Of Notre Dame Cathedral', u'Army Museum'], [u'Lindenhof', u'Knies Kinderzoo', u'Kunsthaus', u'Polish Museum', u'Schloss Rapperswil'], [u'Mount Rigi', u'Engelberg Abbey', u'Lake Lucerne', u'Swiss Museum Of Transport'], [u'Doges Palace', u'Grand Canal', u'Saint Marks Basilica', u'Peggy Guggenheim Collection', u'St Mary Of The Friars'], [u'Rialto Bridge', u'The Phoenix Theatre', u'Church Of San Giorgio Maggiore', u'Venice Biennale Or Biennale Di Venezia', u'Torre Dell Orologio St Marks Clocktower']]",09 May 2016,"[u'London', u'London', u'London', u'London', u'Amsterdam', u'Amsterdam', u'Paris', u'Paris', [u'Rapperswil', u'Zurich'], [u'Lucerne', u'Engelberg'], u'Venice', u'Venice']"
05 May 2014,,"[[u'London Aquarium', u'Palace Of Westminster', u'National Portrait Gallery', u'Tate Modern', u'Madame Tussauds Museum', u'Canary Wharf']]",11 May 2014,London
20 Jun 2016,,"[[u'The London Eye', u'Buckingham Palace London', u'London Underground', u'Borough Market', u'London Aquarium', u'Portobello Market']]",24 Jun 2016,London
11 Apr 2015,50c728cb408698c132000000,"[[u'Big Ben London', u'Buckingham Palace London', u'The London Eye', u'Westminster Abbey']]",12 Apr 2015,London
24 Apr 2015,50c728cb408698c132000000,"[[u'Buckingham Palace London', u'Madame Tussauds Museum', u'British Museum', u'Big Ben London', u'Tower Of London', u'Tower Bridge', u'The London Eye']]",24 Apr 2015,London
19 Jan 2015,543bdcd5e705454527000275,"[[u'Buckingham Palace London', u'The London Eye', u'Big Ben London', u'Tower Of London'], [u'Natural History Museum', u'British Museum', u'6-8 Mill St']]",25 Jan 2015,"London,London"
08 Oct 2016,,"[[u'Natural History Museum', u'Tower Bridge', u'Buckingham Palace London', u'Big Ben London'], [u'St Pauls Cathedral', u'The London Eye', u'Portobello Market', u'Kensington Palace'], [u'Sexmuseum', u'Vondelpark', u'Natura Artis Magistra'], [u'Parc De Bruxelles- National Day Celebration', u'Atomium And Mini Europe ', u'Musical Instruments Museum', u'Moof Museum', u'Grand Place'], [u'Musee D Orsay', u'Luxembourg Gardens'], [u'Towers Of Notre Dame Cathedral', u'Eiffel Tower', u'Musee De L Orangerie'], [u'Lindenhof', u'Old Town'], [u'Wooden Bridge From Rapperswil To Hurden', u'Bahnhofstrasse', u'Golf Now - Indoors', u'Schloss Rapperswil', u'Lake Promenade'], [u'Hofkirche, Court Church Of Innsbruck', u'Cathedral Of Our Lady', u'Triumphpforte, Triumphal Arch', u'Schloss Ambras'], [u'Doges Palace', u'Grand Canal', u'Saint Marks Basilica', u'Peggy Guggenheim Collection', u'Church Of San Giorgio Maggiore'], [u'Central Market', u'Terrazza Mascagni', u'Leaning Tower Of Pisa', u'Guinigi Tower', u'The Knights Square'], [u'Sistine Chapel', u'Pantheon', u'Leonardo Da Vinci International Airport', u'Roman Cat Sanctuary', u'Ristorante Angelina A Trevi']]",19 Oct 2016,"[u'London', u'London', u'Amsterdam', u'Brussels', u'Paris', u'Paris', u'Zurich', [u'Rapperswil', u'Zurich'], [u'Innsbruck', u'Munich'], u'Venice', [u'Pisa', u'Livorno', u'Lucca'], [u'Rome', u'Fiumicino', u'Vatican City']]"
21 Aug 2015,,"[[u'Buckingham Palace London', u'Natural History Museum'], [u'The Centre For Computing History', u'Westminster Abbey', u'Big Ben London', u'Kensington Palace'], [u'Trafalgar Square', u'Tower Of London', u'National Portrait Gallery'], [u'Shakespeares Globe', u'Tower Bridge', u'Hyde Park'], [u'St Pauls Cathedral', u'Royal Albert Hall', u'Tate Modern'], [u'Tate Museum', u'The London Dungeon'], [u'Zsl London Zoo', u'Victoria And Albert Museum', u'Marble Arch']]",27 Aug 2015,"[u'London', [u'London', u'Cambridge'], u'London', u'London', u'London', u'London', u'London']"
15 Jan 2016,5689d21b9bd33eca220000cf,"[[u'Buckingham Palace London', u'Tower Of London'], [u'Victoria And Albert Museum', u'The London Eye']]",16 Jan 2016,"London,London"
23 Jul 2014,,"[[u'The London Eye', u'Big Ben London', u'Buckingham Palace London']]",29 Jul 2014,London
29 Dec 2013,,"[[u'Big Ben London', u'Tower Of London', u'National Gallery', u'Piccadilly Circus']]",30 Dec 2013,London
02 Aug 2015,,"[[u'Buckingham Palace London', u'Natural History Museum', u'Palace Of Westminster'], [u'Westminster Abbey', u'Big Ben London', u'Harrods'], [u'Tower Of London', u'Madame Tussauds Museum', u'The London Eye'], [u'Trafalgar Square', u'Tower Bridge', u'National Portrait Gallery'], [u'Kensington Palace', u'Hms Belfast', u'Old Spitalfields Market', u'Leicester Square']]",06 Aug 2015,"London,London,London,London,London"
