trip_start_time,author_id,trip_path_detail,trip_end_time,trip_path_city
05 Sep 2015,,"[[u'Tower Bridge', u'British Museum'], [u'The Monument', u'Tower Of London', u'London Aquarium'], [u'Madame Tussauds Museum', u'Tate Modern', u'Buckingham Palace London'], [u'Wellington Arch', u'London Transport Museum', u'Harrods'], [u'Shakespeares Globe', u'St Pauls Cathedral', u'Natural History Museum'], [u'National Gallery'], [u'The Royal Botanic Kew Garden', u'National Portrait Gallery'], [u'Kensington Palace', u'Windsor Castle', u'Churchill War Rooms', u'Victoria And Albert Museum']]",12 Sep 2015,"London,London,London,London,London,London,London,London"
21 Jul 2015,559aeaadfbc2e52945000035,"[[u'Natural History Museum', u'Westminster Abbey', u'The London Eye', u'Science Museum - Corporate and Private Hire'], [u'National Gallery'], [u'British Museum', u'Madame Tussauds Museum'], [u'National Portrait Gallery', u'Harrods']]",24 Jul 2015,"London,London,London,London"
11 Jul 2015,,"[[u'Westminster Abbey', u'Madame Tussauds Museum', u'Oxford Street', u'The London Eye'], [u'Buckingham Palace London', u'Harrods', u'Piccadilly Circus']]",12 Jul 2015,"London,London"
23 Aug 2014,559ea079f9c2e5b40a0000cc,"[[u'Buckingham Palace London', u'Big Ben London', u'The London Eye'], [u'Tower Of London', u'National Gallery'], [u'Natural History Museum', u'British Museum'], [u'Westminster Abbey', u'Tate Modern', u'Trafalgar Square'], [u'The London Dungeon', u'Palace Of Westminster', u'Tower Bridge'], [u'London Aquarium', u'London Transport Museum', u'Greenwich Park', u'Tate Museum']]",28 Aug 2014,"London,London,London,London,London,London"
20 Dec 2015,559bdb2ef9c2e5576b000574,"[[u'Buckingham Palace London', u'Big Ben London', u'The London Eye'], [u'Tower Of London', u'National Gallery'], [u'Natural History Museum', u'British Museum'], [u'Westminster Abbey', u'Tate Modern', u'Trafalgar Square'], [u'The London Dungeon', u'Palace Of Westminster', u'Tower Bridge'], [u'London Aquarium', u'London Transport Museum', u'Greenwich Park', u'Tate Museum']]",26 Dec 2015,"London,London,London,London,London,London"
10 Aug 2015,55c2722000fc940d2200009a,"[[u'Tower Of London', u'British Museum', u'Big Ben London']]",11 Aug 2015,London
25 Jun 2016,55c41e1719a23c8013000046,"[[u'Madame Tussauds Museum', u'Big Ben London', u'Buckingham Palace London', u'London Eye'], [u'Fabric', u'Tower Of London'], [u'Tower Bridge', u'Westminster Abbey', u'Hms Belfast', u'Old Spitalfields Market', u'Wimbledon Lawn Tennis Museum'], [u'St Pauls Cathedral', u'Lords The Home Of Cricket', u'Cutty Sark', u'Wellington Arch'], [u'National Maritime Museum', u'Old Royal Naval College', u'Queens House', u'Apsley House'], [u'Club Aquarium', u'Thames Barrier'], [u'Royal Observatory Greenwich', u'Zsl London Zoo'], [u'The London Dungeon', u'The London Eye', u'Piccadilly Circus']]",02 Jul 2016,"London,London,London,London,London,London,London,London"
29 Oct 2015,,"[[u'St Pauls Cathedral', u'Victoria And Albert Museum', u'Portobello Market', u'Millennium Bridge']]",29 Oct 2015,London
16 Aug 2015,55ca15b6531f7184110000ac,"[[u'Buckingham Palace London', u'Tower Of London']]",17 Aug 2015,London
19 May 2016,55f4397a8427a5c56b000053,"[[u'British Museum', u'Royal Albert Hall'], [u'The Monument', u'Churchill War Rooms', u'Victoria And Albert Museum', u'Hyde Park'], [u'Trafalgar Square', u'Shakespeares Globe', u'Natural History Museum']]",21 May 2016,"London,London,London"
05 Jan 2016,,"[[u'The London Eye', u'Buckingham Palace London', u'Victoria And Albert Museum'], [u'Churchill War Rooms']]",06 Jan 2016,"London,London"
12 Jun 2016,,"[[u'Church Of St. Bartholomew The Great', u'The London Eye', u'Buckingham Palace London', u'Queen Elizabeth Olympic Park']]",16 Jun 2016,London
16 Apr 2016,56cffae068d56d1f2900025b,"[[u'Tower Of London', u'The London Eye', u'Buckingham Palace London', u'Tower Bridge', u'Camden Lock Market', u'The View From The Shard', u'Oxford Street']]",16 Apr 2016,London
15 Dec 2014,,"[[u'Harrods', u'Buckingham Palace London', u'The London Eye', u'Big Ben London', u'Oxford Street', u'Tower Of London']]",20 Dec 2014,London
10 Sep 2015,,"[[u'Buckingham Palace London', u'Big Ben London', u'Harrods'], [u'Tower Of London', u'Madame Tussauds Museum', u'The London Eye'], [u'St Pauls Cathedral', u'Natural History Museum', u'Piccadilly Circus'], [u'Trafalgar Square', u'National Portrait Gallery', u'The London Dungeon'], [u'Zsl London Zoo', u'Hyde Park']]",14 Sep 2015,"London,London,London,London,London"
12 Jul 2016,5006cebb76a2954457000002,"[[u'Tower Of London', u'National Gallery']]",13 Jul 2016,London
15 Jul 2015,,"[[u'Tower Of London', u'Madame Tussauds Museum', u'Big Ben London', u'Camden Market'], [u'Club Aquarium', u'Palace Of Westminster', u'Tower Bridge'], [u'Fabric', u'Westminster Abbey', u'The London Eye'], [u'Buckingham Palace London', u'National Maritime Museum', u'Queens House', u'Green Park'], [u'Trafalgar Square', u'Royal Observatory Greenwich']]",19 Jul 2015,"London,London,London,London,London"
30 Jul 2015,,"[[u'Trafalgar Square', u'Westminster Abbey', u'Churchill War Rooms'], [u'National Gallery', u'Palace Of Westminster']]",31 Jul 2015,"London,London"
26 Jul 2015,,"[[u'St Pauls Cathedral', u'Natural History Museum', u'Tower Bridge', u'Big Ben London'], [u'Kensington Palace', u'The London Eye', u'Windsor Castle']]",27 Jul 2015,"London,London"
23 Aug 2014,55b77159531f71bd0e0005b5,"[[u'Buckingham Palace London', u'Big Ben London', u'The London Eye'], [u'Tower Of London', u'National Gallery'], [u'Natural History Museum', u'British Museum'], [u'Westminster Abbey', u'Tate Modern', u'Trafalgar Square'], [u'The London Dungeon', u'Palace Of Westminster', u'Tower Bridge'], [u'London Aquarium', u'London Transport Museum', u'Greenwich Park', u'Tate Museum']]",28 Aug 2014,"London,London,London,London,London,London"
04 Sep 2015,,"[[u'Westminster Abbey', u'Madame Tussauds Museum', u'Oxford Street', u'The London Eye'], [u'Buckingham Palace London', u'Harrods', u'Piccadilly Circus'], [u'Trafalgar Square', u'Tower Of London', u'Natural History Museum'], [u'British Museum', u'The London Dungeon'], [u'National Portrait Gallery', u'Zsl London Zoo']]",08 Sep 2015,"London,London,London,London,London"
04 May 2016,55c69c12521f713a3400044e,"[[u'Natural History Museum', u'The London Dungeon', u'Big Ben London'], [u'Buckingham Palace London', u'Churchill War Rooms', u'The London Eye'], [u'British Museum', u'National Maritime Museum', u'Barbecoa'], [u'Tower Of London', u'Harrods', u'The View From The Shard']]",07 May 2016,"London,London,London,London"
02 Sep 2015,55e5a60fa6e4d0b2520002df,"[[u'British Museum', u'Royal Albert Hall'], [u'The Monument', u'Churchill War Rooms', u'Victoria And Albert Museum', u'Hyde Park'], [u'Trafalgar Square', u'Shakespeares Globe', u'Natural History Museum']]",04 Sep 2015,"London,London,London"
13 Aug 2016,,"[[u'Galway Cathedral', u'Connemara National Park'], [u'Dingle Whiskey Distillery', u'Gallarus Oratory', u'O\\sullivan\\s Courthouse Pub', u'St. James Church'], [u'Ballycotton Cliff Walk', u'Blarney Castle', u'Cork City Gaol'], [u'Trafalgar Square', u'Westminster Abbey', u'National Gallery'], [u'Palace Of Westminster', u'Big Ben London', u'London Transport Museum', u'Churchill War Rooms'], [u'Dublin Zoo', u'National Gallery Of Ireland', u'Temple Bar Company'], [u'St Stephens Greens', u'Phoenix Park', u'National Museum Of Ireland Archaeology']]",19 Aug 2016,"Galway,Dingle,Cork,London,London,Dublin,Dublin"
23 Aug 2015,55d29370cd2e07f6490002ee,"[[u'Tower Bridge', u'Harrods', u'Canary Wharf'], [u'The London Dungeon', u'China Town', u'Victoria And Albert Museum']]",26 Aug 2015,"London,London"
23 Oct 2015,5623f2a0bb69284c7000083e,"[[u'Tower Bridge', u'Harrods', u'Canary Wharf'], [u'The London Dungeon', u'China Town', u'Victoria And Albert Museum']]",24 Oct 2015,"London,London"
09 Jan 2017,,"[[u'Madame Tussauds Museum', u'Natural History Museum', u'Buckingham Palace London', u'Tower Of London', u'Big Ben London']]",13 Jan 2017,London
30 Apr 2016,,"[[u'Westminster Abbey', u'British Museum', u'Royal Albert Hall'], [u'St Pauls Cathedral', u'Victoria And Albert Museum', u'Hyde Park'], [u'Palace Of Westminster', u'Natural History Museum', u'Oxford Street'], [u'Musee D Orsay', u'Disneyland', u'Angelina'], [u'Musee Du Quai Branly', u'Musee De L Orangerie', u'L\\ange 20 Restaurant'], [u'The Palais Royal', u'Towers Of Notre Dame Cathedral', u'La Madeleine Church', u'Cafe Cinema Merci'], [u'Lindenhof', u'Old Town'], [u'Uetliberg', u'Wooden Bridge From Rapperswil To Hurden', u'Schloss Rapperswil', u'Lake Promenade'], [u'Schanzengraben', u'Bahnhofstrasse', u'Golf Now - Indoors', u'Liebfrauenkapelle']]",08 May 2016,"[u'London', u'London', u'London', u'Paris', u'Paris', u'Paris', u'Zurich', [u'Rapperswil', u'Zurich'], [u'Rapperswil', u'Zurich']]"
09 Jun 2016,56bde8bddd853af421000d53,"[[u'Big Ben London', u'Buckingham Palace London', u'Churchill War Rooms', u'British Museum', u'Trafalgar Square', u'Piccadilly Circus'], [], [u'Warner Bros Studios', u'Westminster Abbey'], []]",12 Jun 2016,"London, ,London, "
16 Apr 2016,56cffae068d56d1f2900025b,"[[u'Tower Of London', u'The London Eye', u'Buckingham Palace London', u'Tower Bridge', u'Camden Lock Market', u'The View From The Shard', u'Oxford Street']]",16 Apr 2016,London
02 Mar 2015,54ec7903fbc2e5ee7c000351,"[[u'Trafalgar Square', u'Buckingham Palace London', u'National Portrait Gallery', u'Kings and Marsh']]",02 Mar 2015,London
22 Feb 2016,,"[[u'Madame Tussauds Museum', u'Buckingham Palace London', u'Piccadilly Circus'], [u'National Gallery', u'The London Eye', u'London Aquarium']]",23 Feb 2016,"London,London"
16 Apr 2016,56cffae068d56d1f2900025b,"[[u'Tower Of London', u'The London Eye', u'Buckingham Palace London', u'Tower Bridge', u'Camden Lock Market', u'The View From The Shard', u'Oxford Street']]",16 Apr 2016,London
02 Mar 2015,54f3fe31fbc2e5813e000c98,"[[u'Piccadilly Circus', u'Madame Tussauds Museum', u'The London Eye', u'Soho', u'The Backs']]",08 Mar 2015,"[[u'London', u'Cambridge']]"
26 Sep 2015,551ff85dfbc2e56435000375,"[[u'Big Ben London', u'Buckingham Palace London', u'The London Eye', u'Westminster Abbey', u'Piccadilly Circus', u'Madame Tussauds Museum']]",29 Sep 2015,London
19 Jun 2015,,"[[u'Tower Bridge', u'British Museum'], [u'Shakespeares Globe', u'Tower Of London', u'The Monument'], [u'Buckingham Palace London', u'National Portrait Gallery', u'London Aquarium'], [u'Wellington Arch', u'Madame Tussauds Museum', u'Churchill War Rooms', u'Victoria And Albert Museum', u'Kensington Palace'], [u'St Pauls Cathedral', u'Oxford Covered Market', u'Tate Modern'], [u'Westminster Abbey', u'Windsor Castle', u'Harrods'], [u'The Royal Botanic Kew Garden', u'The London Dungeon', u'London Transport Museum'], [u'Royal Observatory Greenwich', u'Natural History Museum']]",26 Jun 2015,"[u'London', u'London', u'London', u'London', [u'London', u'Oxford'], u'London', u'London', u'London']"
23 Aug 2014,558a4650fac2e53041000229,"[[u'Buckingham Palace London', u'Big Ben London', u'The London Eye'], [u'Tower Of London', u'National Gallery'], [u'Natural History Museum', u'British Museum'], [u'Westminster Abbey', u'Tate Modern', u'Trafalgar Square'], [u'The London Dungeon', u'Palace Of Westminster', u'Tower Bridge'], [u'London Aquarium', u'London Transport Museum', u'Greenwich Park', u'Tate Museum']]",28 Aug 2014,"London,London,London,London,London,London"
12 Jul 2015,,"[[u'Madame Tussauds Museum', u'Buckingham Palace London', u'Piccadilly Circus'], [u'Westminster Abbey', u'The London Eye', u'Harrods']]",13 Jul 2015,"London,London"
19 Aug 2015,559c380ffbc2e5a125000b9f,"[[u'Tower Bridge', u'British Museum'], [u'Shakespeares Globe', u'Tower Of London', u'The Monument'], [u'Buckingham Palace London', u'National Portrait Gallery', u'London Aquarium'], [u'Wellington Arch', u'Madame Tussauds Museum', u'The Royal Botanic Kew Garden', u'Kensington Palace'], [u'St Pauls Cathedral', u'Tate Modern', u'Victoria And Albert Museum'], [u'Westminster Abbey', u'Churchill War Rooms', u'Harrods'], [u'The London Dungeon', u'Windsor Castle', u'London Transport Museum'], [u'Royal Observatory Greenwich', u'Natural History Museum']]",26 Aug 2015,"London,London,London,London,London,London,London,London"
16 Aug 2015,,"[[u'Buckingham Palace London', u'Natural History Museum', u'The London Eye', u'Science Museum - Corporate and Private Hire'], [u'National Gallery'], [u'British Museum', u'Victoria And Albert Museum'], [u'Madame Tussauds Museum', u'Churchill War Rooms', u'Harrods']]",19 Aug 2015,"London,London,London,London"
12 Jul 2015,559bce43fbc2e5a325000467,"[[u'Buckingham Palace London', u'The London Eye', u'Harrods'], [u'Westminster Abbey', u'Madame Tussauds Museum', u'Tower Bridge', u'Big Ben London']]",13 Jul 2015,"London,London"
06 Aug 2015,,"[[u'Madame Tussauds Museum', u'Buckingham Palace London', u'Piccadilly Circus'], [u'Tower Of London', u'The London Eye', u'Victoria And Albert Museum']]",07 Aug 2015,"London,London"
01 Dec 2015,,"[[u'Westminster Abbey', u'Madame Tussauds Museum', u'Oxford Street', u'The London Eye'], [u'Buckingham Palace London', u'Harrods', u'Piccadilly Circus'], [u'Trafalgar Square', u'Tower Of London', u'Natural History Museum'], [u'British Museum', u'The London Dungeon'], [u'National Portrait Gallery', u'Zsl London Zoo']]",05 Dec 2015,"London,London,London,London,London"
19 Aug 2015,55ce2388a5e4d0595b000120,"[[u'Buckingham Palace London', u'The London Eye', u'Harrods'], [u'Tower Of London', u'Big Ben London', u'Tower Bridge', u'Victoria And Albert Museum']]",20 Aug 2015,"London,London"
24 Aug 2015,55d0024d00fc94602e000766,"[[u'Buckingham Palace London', u'Big Ben London', u'Natural History Museum'], [u'Tower Of London', u'The London Eye', u'Tate Modern'], [u'Trafalgar Square', u'Westminster Abbey', u'London Aquarium'], [u'The London Dungeon', u'London Transport Museum', u'Palace Of Westminster'], [u'Tower Bridge', u'Greenwich Park', u'Hms Belfast', u'Old Spitalfields Market', u'Victoria And Albert Museum'], [u'Tate Museum', u'Churchill War Rooms', u'Zsl London Zoo']]",29 Aug 2015,"London,London,London,London,London,London"
02 Sep 2015,55e0a26d6bd56db605000000,"[[u'Madame Tussauds Museum', u'Buckingham Palace London', u'Piccadilly Circus'], [u'Tower Of London', u'British Museum', u'Big Ben London']]",03 Sep 2015,"London,London"
25 Sep 2015,55e7d66af3a73dfc6d000265,"[[u'British Museum', u'Covent Garden'], [u'National Gallery'], [u'The Monument', u'Natural History Museum', u'Harrods']]",27 Sep 2015,"London,London,London"
30 Aug 2015,,"[[u'Tower Bridge', u'Harrods', u'Canary Wharf'], [u'The London Dungeon', u'China Town', u'Victoria And Albert Museum']]",31 Aug 2015,"London,London"
10 Apr 2016,,"[[u'Lindenhof', u'Knies Kinderzoo', u'Kunsthaus', u'Polish Museum', u'Schloss Rapperswil'], [u'Lake Promenade', u'Fraumunster', u'Wooden Bridge From Rapperswil To Hurden', u'Bier Factory Rapperswil', u'Liebfrauenkapelle'], [u'Zurich Zoological Garden', u'Bahnhofstrasse'], [u'Acropolis', u'Temple Of Athena Nike', u'Odeon Of Herodes Atticus'], [u'Erechtheion', u'Acropolis Museum', u'Parthenon'], [u'Sacre Coeur Montmartrel', u'Musee Du Quai Branly', u'Pont Neuf', u'Pierre Herme'], [u'La Defense', u'Musee De L Orangerie', u'Arc De Triomphe'], [u'Buckingham Palace London', u'The London Eye', u'Harrods'], [u'Tower Of London', u'Big Ben London', u'Tower Bridge', u'Victoria And Albert Museum']]",18 Apr 2016,"[[u'Rapperswil', u'Zurich'], [u'Rapperswil', u'Zurich'], u'Zurich', u'Athens', u'Athens', u'Paris', u'Paris', u'London', u'London']"
04 Nov 2015,,"[[u'St Pauls Cathedral', u'Big Ben London', u'Victoria And Albert Museum', u'Regents Park', u'Tobacco Dock'], [u'Buckingham Palace London', u'Churchill War Rooms', u'The London Eye', u'Newcastle'], [u'Fabric', u'Tower Bridge', u'The View From The Shard']]",06 Nov 2015,"London,London,London"
05 Mar 2016,,"[[u'The London Eye', u'Big Ben London', u'Tower Of London']]",05 Mar 2016,London
08 Jan 2016,,"[[u'Trafalgar Square', u'Westminster Abbey', u'National Gallery'], [u'Palace Of Westminster', u'Big Ben London', u'London Transport Museum', u'Churchill War Rooms'], [u'The Palais Royal', u'Grand Palais', u'Towers Of Notre Dame Cathedral', u'Champ De Mars'], [u'Palais De Chaillot', u'Disneyland', u'Musee Du Quai Branly', u'National Library'], [u'The Scott Monument', u'Edinburgh Castle', u'Arniston House', u'St Giles Cathedral'], [u'Tropical World', u'Oulton Hall', u'Trinity Leeds', u'Napolean\\s Casino', u'National Coal Mining For England']]",13 Jan 2016,"London,London,Paris,Paris,Edinburgh,Leeds"
18 Feb 2016,54f851f8e70545077500008e,"[[u'Big Ben London', u'Buckingham Palace London', u'Harrods', u'St Pauls Cathedral', u'Kensington Palace']]",21 Feb 2016,London
18 Feb 2016,,"[[u'St Pauls Cathedral', u'Big Ben London', u'Tower Bridge', u'Buckingham Palace London'], [u'Kensington Palace', u'Natural History Museum', u'The London Eye', u'London Aquarium']]",19 Feb 2016,"London,London"
20 Jul 2016,,"[[u'Oxford Street', u'Tower Bridge', u'Buckingham Palace London', u'The London Eye'], [u'Tower Of London', u'Big Ben London', u'Portobello Market'], [u'Zoological Garden', u'Museum Island', u'Brandenburg Gate'], [u'Pergamon Museum', u'Dahlem Museum', u'East Side Gallery'], [u'St Marks Square', u'Church Of San Giorgio Maggiore', u'Doges Palace', u'Saint Marks Basilica', u'Peggy Guggenheim Collection'], [u'Rialto Bridge', u'Cannaregio', u'Interpreti Veneziani', u'Ca Rezzonico', u'The Phoenix Theatre']]",25 Jul 2016,"London,London,Berlin,Berlin,Venice,Venice"
16 Feb 2015,,"[[u'Big Ben London', u'Trafalgar Square', u'The London Eye', u'Tower Of London']]",17 Feb 2015,London
11 Jul 2016,,"[[u'Mabledon Court Hotel', u'The London Eye', u'Big Ben London', u'Victoria And Albert Museum', u'Mabledon Court Hotel'], [u'Mabledon Court Hotel', u'British Museum', u'Madame Tussauds Museum', u'Mabledon Court Hotel'], [u'Mabledon Court Hotel', u'Tower Of London', u'Tower Bridge', u'Natural History Museum', u'Mabledon Court Hotel']]",13 Jul 2016,"London,London,London"
23 Aug 2014,5588fcadf9c2e5b374000b62,"[[u'Buckingham Palace London', u'Big Ben London', u'The London Eye'], [u'Tower Of London', u'National Gallery'], [u'Natural History Museum', u'British Museum'], [u'Westminster Abbey', u'Tate Modern', u'Trafalgar Square'], [u'The London Dungeon', u'Palace Of Westminster', u'Tower Bridge'], [u'London Aquarium', u'London Transport Museum', u'Greenwich Park', u'Tate Museum']]",28 Aug 2014,"London,London,London,London,London,London"
30 Jun 2015,,"[[u'Buckingham Palace London', u'The London Eye', u'Harrods'], [u'Westminster Abbey', u'Madame Tussauds Museum', u'Tower Bridge', u'Big Ben London']]",01 Jul 2015,"London,London"
11 Jul 2015,559af745f9c2e5904e0008c7,"[[u'Buckingham Palace London', u'The London Eye', u'Harrods'], [u'Tower Of London', u'Madame Tussauds Museum', u'Tower Bridge', u'Big Ben London']]",12 Jul 2015,"London,London"
03 Aug 2015,5006cebb76a2954457000002,"[[u'Buckingham Palace London', u'The London Eye']]",19 Aug 2015,London
06 Jul 2015,,"[[u'Buckingham Palace London', u'Big Ben London', u'Harrods'], [u'Westminster Abbey', u'Natural History Museum', u'The London Eye'], [u'Tower Of London', u'Piccadilly Circus'], [u'Trafalgar Square', u'St Pauls Cathedral', u'Wellington Arch', u'Tower Bridge']]",09 Jul 2015,"London,London,London,London"
01 Jul 2015,5006cebb76a295445700000a,"[[u'Buckingham Palace London', u'The London Eye', u'Harrods'], [u'Westminster Abbey', u'Madame Tussauds Museum', u'Tower Bridge', u'Big Ben London']]",02 Jul 2015,"London,London"
13 Jul 2015,,"[[u'Buckingham Palace London', u'The London Eye', u'Harrods'], [u'Westminster Abbey', u'Madame Tussauds Museum', u'Tower Bridge', u'Big Ben London']]",14 Jul 2015,"London,London"
01 Aug 2015,55b6658519a23c22090001b8,"[[u'Natural History Museum', u'Buckingham Palace London']]",02 Aug 2015,London
30 Jul 2015,55b3f1daf3a73d9c6a0010fc,"[[u'St Pauls Cathedral', u'Natural History Museum', u'Tower Bridge', u'Big Ben London'], [u'Kensington Palace', u'The London Eye', u'Windsor Castle']]",31 Jul 2015,"London,London"
23 Aug 2014,55b8005d521f71d30b000780,"[[u'Buckingham Palace London', u'Big Ben London', u'The London Eye'], [u'Tower Of London', u'National Gallery'], [u'Natural History Museum', u'British Museum'], [u'Westminster Abbey', u'Tate Modern', u'Trafalgar Square'], [u'The London Dungeon', u'Palace Of Westminster', u'Tower Bridge'], [u'London Aquarium', u'London Transport Museum', u'Greenwich Park', u'Tate Museum']]",28 Aug 2014,"London,London,London,London,London,London"
16 Aug 2015,55ca71ec9bb25e000600029a,"[[u'Madame Tussauds Museum', u'Buckingham Palace London', u'Piccadilly Circus'], [u'Tower Of London', u'The London Eye', u'Victoria And Albert Museum']]",17 Aug 2015,"London,London"
03 Oct 2015,,"[[u'Madame Tussauds Museum', u'Big Ben London', u'Buckingham Palace London', u'London Eye'], [u'Fabric', u'Tower Of London'], [u'Tower Bridge', u'Westminster Abbey', u'Hms Belfast', u'Old Spitalfields Market', u'Wimbledon Lawn Tennis Museum'], [u'St Pauls Cathedral', u'Wellington Arch', u'Cutty Sark', u'Lords The Home Of Cricket'], [u'National Maritime Museum', u'Old Royal Naval College', u'Queens House', u'Apsley House'], [u'Club Aquarium', u'Thames Barrier'], [u'Royal Observatory Greenwich', u'Zsl London Zoo'], [u'The London Dungeon', u'The London Eye', u'Piccadilly Circus']]",10 Oct 2015,"London,London,London,London,London,London,London,London"
03 Aug 2015,,"[[u'Buckingham Palace London', u'Big Ben London', u'Piccadilly Circus'], [u'The London Eye', u'Barbecoa', u'Ye Olde Cheshire Cheese', u'Selfridges And Co']]",04 Aug 2015,"London,London"
04 Oct 2015,,"[[u'Buckingham Palace London', u'The London Eye', u'Harrods'], [u'Tower Of London', u'Big Ben London', u'Tower Bridge', u'Victoria And Albert Museum']]",05 Oct 2015,"London,London"
30 Dec 2015,,"[[u'Buckingham Palace London', u'Harrods', u'Piccadilly Circus', u'Big Ben London'], [u'Trafalgar Square', u'Natural History Museum', u'The London Dungeon'], [u'British Museum', u'Zsl London Zoo']]",01 Jan 2016,"London,London,London"
23 Aug 2014,557b77f2fac2e5402b000c2a,"[[u'Buckingham Palace London', u'Big Ben London', u'The London Eye'], [u'Tower Of London', u'National Gallery'], [u'Natural History Museum', u'British Museum'], [u'Westminster Abbey', u'Tate Modern', u'Trafalgar Square'], [u'The London Dungeon', u'Palace Of Westminster', u'Tower Bridge'], [u'London Aquarium', u'London Transport Museum', u'Greenwich Park', u'Tate Museum']]",28 Aug 2014,"London,London,London,London,London,London"
23 Dec 2015,563afeeb8427a58b4c000178,"[[u'Churchill War Rooms', u'Tower Of London', u'Buckingham Palace London', u'The London Eye', u'Big Ben London']]",31 Dec 2015,London
19 Jan 2016,,"[[u'Madame Tussauds Museum', u'Buckingham Palace London', u'Piccadilly Circus'], [u'The London Eye', u'Portobello Market', u'Victoria And Albert Museum']]",20 Jan 2016,"London,London"
20 Sep 2016,56986872a6d46d0729000071,"[[u'Westminster Abbey', u'The London Eye', u'Victoria And Albert Museum'], [u'Natural History Museum', u'Hampton Court Palace', u'Big Ben London'], [u'Madame Tussauds Museum', u'Tower Of London', u'The View From The Shard'], [u'Sainte Chapelle', u'Towers Of Notre Dame Cathedral', u'Arc Du Carrousel', u'Catacombs Of Paris'], [u'La Conciergerie', u'La Defense', u'Army Museum'], [u'Musee Dorsay', u'Palais Garnier', u'Pierre Herme', u'Pont Neuf'], [u'Oude Kerk', u'Church Of St Nicholas', u'Concertgebouw', u'Hotel Nh Amsterdam Museum Quarter', u'Amsterdam Centraal'], [u'Royal Palace', u'Amsterdam Centraal Railway Station', u'Amsterdam Canals'], [u'Rijksmuseum', u'Dam Square', u'Singel'], [u'Sachsenhausen', u'The Main Tower', u'St Pauls Church', u'Mathildenhoehe Und Jugendstil Kolonie'], [u'Romerberg', u'The Goethe House', u'Zoo Vivarium Darmstadt']]",30 Sep 2016,"[u'London', u'London', u'London', u'Paris', u'Paris', u'Paris', u'Amsterdam', u'Amsterdam', u'Amsterdam', [u'Frankfurt', u'Darmstadt'], [u'Frankfurt', u'Darmstadt']]"
19 Jan 2016,,"[[u'Madame Tussauds Museum', u'Buckingham Palace London', u'Piccadilly Circus'], [u'The London Eye', u'Portobello Market', u'Victoria And Albert Museum']]",20 Jan 2016,"London,London"
16 Apr 2016,56cffae068d56d1f2900025b,"[[u'Tower Of London', u'The London Eye', u'Buckingham Palace London', u'Tower Bridge', u'Camden Lock Market', u'The View From The Shard', u'Oxford Street']]",16 Apr 2016,London
16 Apr 2016,56cffae068d56d1f2900025b,"[[u'Tower Of London', u'The London Eye', u'Buckingham Palace London', u'Tower Bridge', u'Camden Lock Market', u'The View From The Shard', u'Oxford Street']]",16 Apr 2016,London
12 Jun 2016,575dc43b4e8231191800032d,"[[u'British Museum', u'The London Eye']]",17 Jun 2016,London
19 Apr 2015,,"[[u'Buckingham Palace London', u'Windsor Castle', u'Palace Of Westminster'], [u'Big Ben London', u'Westminster Abbey', u'Hampton Court Palace']]",21 Apr 2015,"London,London"
03 Jun 2015,,"[[u'Tower Bridge', u'British Museum'], [u'Shakespeares Globe', u'The Monument', u'Tower Of London'], [u'Buckingham Palace London', u'National Portrait Gallery', u'London Aquarium'], [u'Wellington Arch', u'Madame Tussauds Museum', u'Churchill War Rooms', u'Victoria And Albert Museum', u'Kensington Palace'], [u'St Pauls Cathedral', u'Oxford Covered Market', u'Tate Modern'], [u'Westminster Abbey', u'Windsor Castle', u'Harrods', u'Piccadilly Circus'], [u'The Royal Botanic Kew Garden', u'The London Dungeon', u'London Transport Museum'], [u'Royal Observatory Greenwich', u'Natural History Museum']]",10 Jun 2015,"[u'London', u'London', u'London', u'London', [u'London', u'Oxford'], u'London', u'London', u'London']"
02 May 2015,553e561bf9c2e57a7a000b05,"[[u'The London Dungeon', u'Big Ben London']]",03 May 2015,London
