trip_start_time,author_id,trip_path_detail,trip_end_time,trip_path_city
15 Aug 2015,,"[[u'Old Montreal', u'Mosaicultures Internationales', u'St Josephs Oratory Of Mount Royal'], [u'Mount Royal', u'Notre-dame Basilica'], [u'Lorchestre Symphonique De Montreal', u'Mont Royal Cemetery', u'Place Des Arts'], [u'Montreal Biodome', u'Three Monkeys', u'La Citadelle'], [u'Montreals Underground City', u'Musee Pointe-a-calliere', u'Musee Des Beaux-arts De Montreal'], [u'La Citadelle', u'Musee Du Fort', u'Cathedral Of The Holy Trinity'], [u'Place Royale', u'Museum Of French America Or Musee De L\\ameriquefrancaise', u'Musee De La Civilisation'], [u'Basilique Cathedrale - Notre-dame-de-quebec', u'Fortifications Of Qu\xe9bec National Historic Site', u'Musee National Des Beaux Arts Or Du Quebec']]",22 Aug 2015,"Montreal,Montreal,Montreal,Montreal,Montreal,Quebec,Quebec,Quebec"
29 Aug 2015,,"[[u'Mosaicultures Internationales', u'Notre-dame Basilica'], [u'Musee Des Beaux-arts De Montreal', u'Botanical Garden'], [u'Mont Royal Cemetery', u'Old Montreal'], [u'Lorchestre Symphonique De Montreal', u'Le Village', u'Belgo Building'], [u'Place Des Arts', u'La Citadelle', u'Les Bobards'], [u'Canadian Railway Museum', u'The Olympic Park', u'Three Monkeys'], [u'Mount Royal', u'Montreal Biodome', u'Circuit Gilles Villeneuve'], [u'Musee Pointe-a-calliere', u'Montreals Underground City']]",07 Sep 2015,"Montreal,Montreal,Montreal,Montreal,Montreal,Montreal,Montreal,Montreal"
04 May 2017,,"[[u'Mont Royal Cemetery', u'Botanical Garden'], [u'The Olympic Park', u'Notre-dame Basilica'], [u'Mosaicultures Internationales', u'Belgo Building', u'Musee Des Beaux-arts De Montreal'], [u'Lorchestre Symphonique De Montreal', u'Old Montreal', u'Place Des Arts']]",07 May 2017,"Montreal,Montreal,Montreal,Montreal"
02 Nov 2015,55ce498ea5e4d0dc050009a8,"[[u'The Olympic Park', u'Musee Des Beaux-arts De Montreal', u'Cora - Montr\xe9al-centre', u'Les Bobards'], [u'Lorchestre Symphonique De Montreal', u'Three Monkeys', u'Place Des Arts', u'Biodome', u'Musee National Des Beaux Arts Or Du Quebec'], [u'Montreal Biodome', u'Belgo Building', u'Terrasse Dufferin'], [u'Mosaicultures Internationales', u'La Citadelle', u'Choco Musee Erico', u'Fortifications Of Qu\xe9bec National Historic Site'], [u'Botanical Garden', u'Musee Du Fort', u'Morrin Centre'], [u'Old Montreal', u'Cathedral Of The Holy Trinity', u'Museum Of French America Or Musee De L\\ameriquefrancaise']]",07 Nov 2015,"[u'Montreal', [u'Montreal', u'Quebec'], [u'Montreal', u'Quebec'], [u'Montreal', u'Quebec'], [u'Montreal', u'Quebec'], [u'Montreal', u'Quebec']]"
28 Aug 2015,,"[[u'Old Montreal', u'Notre-dame Basilica'], [u'Musee Pointe-a-calliere', u'The Olympic Park'], [u'Mosaicultures Internationales', u'Montreal Biodome']]",30 Aug 2015,"Montreal,Montreal,Montreal"
03 Sep 2015,,"[[u'Botanical Garden', u'Montreal Biodome', u'Notre-dame Basilica', u'Le Village']]",07 Sep 2015,Montreal
21 Apr 2016,,"[[u'London, On', u'Montreal, Pq', u'Chateau Ramezay Museum', u'M\xe9tropolis'], [u'Botanical Garden', u'Notre-dame Basilica', u'Musee Des Beaux-arts De Montreal', u'Jean-talon Market', u'St Josephs Oratory Of Mount Royal'], [u'Montreal, Pq', u'London, On']]",23 Apr 2016,"Montreal,Montreal, "
05 Aug 2016,,"[[u'Qu\xe9bec, Qc', u'Montr\xe9al, Qc', u'Hotel Travelodge Montreal Centre', u'Mosaicultures Internationales', u'Lorchestre Symphonique De Montreal', u'Le Village', u'Three Monkeys'], [u'Hotel Travelodge Montreal Centre', u'Botanical Garden', u'Les Bobards'], [u'Hotel Travelodge Montreal Centre', u'La Citadelle', u'Belgo Building', u'Old Montreal', u'Montr\xe9al, Qc', u'Qu\xe9bec, Qc']]",07 Aug 2016,"Montreal,Montreal,Montreal"
01 Aug 2016,5735d3184e8231e776001e8e,"[[u'Calgary Airport', u'Yellowknife Airport'], [u'Yellowknife Airport', u'Yellowknife Airport', u'Cellar Bar and Grill', u'Capital Suites Yellowknife', u'Aurora Village', u'A and W', u'Prelude Lake Territorial Park', u'Great Slave Lake', u'Sushi North'], [u'Capital Suites Yellowknife', u'Gourmet Cup', u'Northern Frontier Visitors Center', u'Cameron River Ramparts', u'Twist', u'Ingraham Trail', u'The Wildcat Cafe', u'Giant Mine', u'LAtitudes'], [u'Capital Suites Yellowknife', u'Taste of Saigon', u'Cameron River Falls', u'Gold Range Bistro', u'Yellowknife Airport', u'Winnipeg Airport', u'Norwood Hotel'], [u'Norwood Hotel', u'Bannock Factory', u'Assiniboine Park Zoo', u'Vilais Spice Box', u'The Forks National Historic Site', u'St. Boniface Museum And Cathedral', u'Leo Mol Sculpture Garden', u'Winnipeg Art Gallery'], [u'Norwood Hotel', u'Chef Express of India', u'Manitoba Legislative Museum', u'Assiniboine Park', u'Vilais Spice Box', u'Fort Whyte', u'Tinkertown Family Fun Park', u'Stuff It'], [u'Norwood Hotel', u'Fired Up', u'Shaw Park', u'Centennial Concert Hall', u'Waki Temaki Sushi Trailer', u'Winnipeg Airport', u'Montreal Airport', u'Hotel Travelodge Montreal Centre', u'Le Village'], [u'Hotel Travelodge Montreal Centre', u'Bo\xeete \xc0 Fromages', u'Mosaicultures Internationales', u'Mont Royal Cemetery', u'Nomade So6'], [u'Hotel Travelodge Montreal Centre', u'Smoothfruit', u'Lorchestre Symphonique De Montreal', u'Super Truck', u'Old Montreal', u'Lolas Petits Gateaux', u'Montreal Airport', u'Calgary Airport'], [u'Calgary Airport', u'Calgary Airport']]",10 Aug 2016,"[' ', u'Yellowknife', u'Yellowknife', u'Yellowknife', u'Winnipeg', u'Winnipeg', [u'Winnipeg', u'Montreal'], u'Montreal', u'Montreal', ' ']"
02 May 2016,,"[[u'Sardar Vallabhbhai Patel International Airport', u'Toronto Airport', u'Best Western Roehampton Hotel and Suites', u'C N Tower', u'Chinatown'], [u'Best Western Roehampton Hotel and Suites', u'Toronto Eaton Centre', u'Distillery District', u'Centre Island'], [u'Casa Loma', u'Art Gallery Of Ontario Or A G O', u'Best Western Roehampton Hotel and Suites', u'Toronto City Center', u'Niagara Falls City Center', u'Courtyard By Marriott Niagara Falls'], [u'Courtyard By Marriott Niagara Falls', u'Buffalo City Hall', u'Darwin D Martin House', u'Journey Behind The Falls', u'Bird Kingdom', u'First Niagara Center'], [u'Courtyard By Marriott Niagara Falls', u'Niagara Falls', u'White Water Walk', u'Theodore Roosevelt Inaugural National Historic Site', u'Louis Tussauds Waxworks'], [u'Table Rock', u'Albright-Knox Art Gallery', u'Buffalo Zoo', u'Courtyard By Marriott Niagara Falls', u'Niagara Falls City Center', u'Montreal City Center', u'Hotel Travelodge Montreal Centre'], [u'Hotel Travelodge Montreal Centre', u'Mosaicultures Internationales', u'Circuit Gilles Villeneuve', u'St Josephs Oratory Of Mount Royal', u'Three Monkeys', u'Terrasse Dufferin'], [u'Hotel Travelodge Montreal Centre', u'Botanical Garden', u'Le Village', u'Les Bobards'], [u'Hotel Travelodge Montreal Centre', u'La Citadelle', u'Notre-dame Basilica', u'Mount Royal'], [u'Lorchestre Symphonique De Montreal', u'Chateau Ramezay Museum', u'Canadian Railway Museum', u'Hotel Travelodge Montreal Centre', u'Montreal Airport', u'Vancouver Airport', u'Moda Hotel'], [u'Moda Hotel', u'Stanley Park', u'Queen Elizabeth Park', u'Vancouver Lookout', u'Grouse Mountain', u'Orpheum Theatre', u'Spanish Banks', u'Jericho Beach', u'Robson Street', u'Gastown Vancouver'], [u'Moda Hotel', u'Capilano Suspension Bridge', u'Science World', u'Granville Island', u'Vancouver Aquarium', u'Museum Of Anthropology'], [u'Moda Hotel', u'Vancouver Airport', u'Sardar Vallabhbhai Patel International Airport'], [], [u'Sardar Vallabhbhai Patel International Airport', u'Sardar Vallabhbhai Patel International Airport']]",16 May 2016,"[[u'Ahmedabad', u'Toronto'], u'Toronto', u'Toronto', [u'Buffalo', u'Niagara Falls'], [u'Buffalo', u'Niagara Falls'], [u'Buffalo', u'Niagara Falls'], [u'Montreal', u'Quebec'], u'Montreal', u'Montreal', u'Montreal', u'Vancouver', u'Vancouver', u'Ahmedabad', ' ', u'Ahmedabad']"
30 Apr 2016,,"[[u'Mosaicultures Internationales', u'St Josephs Oratory Of Mount Royal'], [u'Chateau Ramezay Museum', u'Botanical Garden'], [u'The Olympic Park', u'Musee Des Beaux-arts De Montreal', u'Place Des Arts'], [u'Montreal Biodome', u'La Citadelle', u'Choco Musee Erico', u'Lorchestre Symphonique De Montreal'], [u'Museum Of French America Or Musee De L\\ameriquefrancaise', u'Musee Du Fort', u'Musee National Des Beaux Arts Or Du Quebec', u'Morrin Centre'], [u'Old Montreal', u'Fortifications Of Qu\xe9bec National Historic Site', u'Cathedral Of The Holy Trinity'], [u'Basilique Cathedrale - Notre-dame-de-quebec', u'Belgo Building', u'Place Royale']]",06 May 2016,"[u'Montreal', u'Montreal', u'Montreal', [u'Montreal', u'Quebec'], u'Quebec', [u'Montreal', u'Quebec'], [u'Montreal', u'Quebec']]"
08 Aug 2016,,"[[u'Morganville City Center', u'Montreal City Center', u'Bandb Bleu Balcon'], [u'Bandb Bleu Balcon', u'Mosaicultures Internationales', u'Botanical Garden', u'Bandb Bleu Balcon'], [u'Bandb Bleu Balcon', u'Mont Royal Cemetery', u'La Citadelle', u'Montreal Airport', u'Morganville City Center']]",10 Aug 2016,"[u'Morganville', u'Montreal', [u'Morganville', u'Montreal']]"
17 Aug 2016,,"[[u'Eden Prairie City Center', u'Mont-tremblant City Center'], [u'Mont-tremblant City Center', u'Mont-tremblant City Center', u'The Whiskey Bar At Grand Lodge', u'Mont Tremblant Resort'], [u'Auberge Mountain View Inn', u'Casino De Mont-tremblant', u'Aventures Parc Mont-Tremblant', u'Mont Tremblant National Park', u'Le Geant Golf Course'], [u'Auberge Mountain View Inn', u'Mont Tremblant Activity Centre', u'Le Diable Golf Course'], [u'Auberge Mountain View Inn', u'Mont Blanc'], [u'Auberge Mountain View Inn', u'Circuit Mont Tremblant', u'Ski De Fond Mont-tremblant'], [u'Auberge Mountain View Inn', u'Mont-tremblant City Center', u'Montreal City Center', u'Hotel Travelodge Montreal Centre', u'Notre-dame Basilica', u'Le Village'], [u'Hotel Travelodge Montreal Centre', u'Mosaicultures Internationales', u'Botanical Garden', u'Musee Des Beaux-arts De Montreal'], [u'Hotel Travelodge Montreal Centre', u'Montreal City Center', u'Eden Prairie City Center'], [u'Eden Prairie City Center', u'Eden Prairie City Center']]",26 Aug 2016,"[[u'Mont-tremblant', u'Eden Prairie'], u'Mont-tremblant', u'Mont-tremblant', u'Mont-tremblant', u'Mont-tremblant', u'Mont-tremblant', [u'Mont-tremblant', u'Montreal'], u'Montreal', u'Eden Prairie', u'Eden Prairie']"
12 Aug 2016,,"[[u'Pune Airport', u'Montreal Airport', u'Best Western Plus Montreal Downtown- Hotel Europa', u'Musee Des Beaux-arts De Montreal', u'Best Western Plus Montreal Downtown- Hotel Europa'], [u'Best Western Plus Montreal Downtown- Hotel Europa', u'Mosaicultures Internationales', u'Botanical Garden', u'Best Western Plus Montreal Downtown- Hotel Europa'], [u'Best Western Plus Montreal Downtown- Hotel Europa', u'Le Village', u'La Citadelle', u'Montreal Airport', u'Pune Airport'], [], [u'Pune Airport', u'Pune Airport']]",16 Aug 2016,"Montreal,Montreal,Montreal, , "
24 Sep 2016,,"[[u'Ottawa, On', u'Montreal, Pq', u'Samesun Montreal Central', u'Mont Royal Cemetery', u'Notre-dame Basilica', u'Samesun Montreal Central'], [u'Samesun Montreal Central', u'Mosaicultures Internationales', u'Botanical Garden', u'Samesun Montreal Central'], [u'Samesun Montreal Central', u'Montreal, Pq', u'Ottawa, On']]",26 Sep 2016,"Montreal,Montreal, "
02 Sep 2016,,"[[u'Milton City Center', u'Montreal City Center', u'Mosaicultures Internationales', u'Musee Des Beaux-arts De Montreal'], [u'Lorchestre Symphonique De Montreal', u'Botanical Garden'], [u'Mont Royal Cemetery', u'Old Montreal', u'Montreal City Center', u'Milton City Center']]",04 Sep 2016,"Montreal,Montreal,Montreal"
01 Jul 2016,,"[[u'Holiday Inn Montreal Centre Ville Downtown', u'Mosaicultures Internationales', u'Botanical Garden', u'The Olympic Park', u'Holiday Inn Montreal Centre Ville Downtown'], [u'Holiday Inn Montreal Centre Ville Downtown', u'Casino De Montreal', u'Old Montreal', u'Notre-dame Basilica', u'Chateau Ramezay Museum', u'Holiday Inn Montreal Centre Ville Downtown'], [u'Holiday Inn Montreal Centre Ville Downtown', u'Musee Des Beaux-arts De Montreal', u'La Citadelle', u'Three Monkeys', u'Montreals Underground City', u'Holiday Inn Montreal Centre Ville Downtown'], [u'Holiday Inn Montreal Centre Ville Downtown', u'Mont Royal Cemetery', u'Mount Royal', u'St Josephs Oratory Of Mount Royal', u'Holiday Inn Montreal Centre Ville Downtown'], [u'Holiday Inn Montreal Centre Ville Downtown', u'Le Village', u'Place Des Arts', u'Circuit Gilles Villeneuve', u'Les Bobards', u'Holiday Inn Montreal Centre Ville Downtown'], [u'Holiday Inn Montreal Centre Ville Downtown', u'Lorchestre Symphonique De Montreal', u'Montreal Biodome', u'Belgo Building', u'Terrasse Dufferin', u'Holiday Inn Montreal Centre Ville Downtown'], [u'Holiday Inn Montreal Centre Ville Downtown', u'Canadian Railway Museum', u'Musee Pointe-a-calliere', u'Holiday Inn Montreal Centre Ville Downtown'], [u'Holiday Inn Montreal Centre Ville Downtown']]",08 Jul 2016,"[u'Montreal', [u'Montreal', u'Quebec'], u'Montreal', u'Montreal', u'Montreal', [u'Montreal', u'Quebec'], u'Montreal', ' ']"
23 Jul 2016,5791985f4e82318c43000bb3,"[[u'Tenafly City Center', u'Montreal City Center', u'Notre-dame Basilica', u'Montreal Biodome', u'Botanical Garden', u'Musee Des Beaux-arts De Montreal', u'Saint Josephs Oratory Of Mount Royal', u'Cacao 70 Mont Royal', u'Olive Et Gourmando'], [u'Montreal City Center', u'Quebec City Center', u'La Citadelle', u'Chateau Frontenac', u'Musee De La Civilisation', u'Parc De La Chute Montmorency', u'Hotel De Glace', u'Quebec City Center', u'Montreal City Center'], [u'Montreal City Center', u'Wilmington City Center', u'Whiteface Mountain', u'Lake Placid Winter Olympic Museum', u'Olympic Jumping Complex', u'Wilmington City Center', u'Tenafly City Center']]",25 Jul 2016,"[[u'Tenafly', u'Montreal'], u'Quebec', [u'Tenafly', u'Wilmington', u'Lake Placid']]"
09 Sep 2016,,"[[u'Mosaicultures Internationales', u'Botanical Garden', u'The Olympic Park'], [u'Circuit Gilles Villeneuve', u'Chateau Ramezay Museum', u'Notre-dame Basilica', u'Montreals Underground City'], [u'Mooneys Bay Park', u'Vincent Massey Park', u'Midway Family Fun Park'], [u'Chapman MIlls Conservation Area', u'Manderley On The Green ', u'Richmond Centennial Golf Course ', u'Glen Mar Golf and Country Club ', u'Blue Bamboo Yoga ', u'Irish Hills Golf and Country Club ', u'Diefenbunker - Canadas Cold War Museum ', u'Loch March Golf and Country Club ', u'Greensmere Golf and Country Club '], [u'Toronto Eaton Centre', u'Royal Ontario Museum'], [u'C N Tower', u'St Lawrence Market', u'Art Gallery Of Ontario Or A G O'], [u'Richardson Olmsted Complex', u'Skylon Tower', u'Table Rock', u'Journey Behind The Falls', u'Louis Tussauds Waxworks'], [u'Ripleys Believe It Or Not Museum', u'Niagara Falls', u'The Whirlpool Aero Car', u'White Water Walk', u'Buffalo Religious Arts Center']]",16 Sep 2016,"[u'Montreal', u'Montreal', u'Ottawa', u'Ottawa', u'Toronto', u'Toronto', [u'Buffalo', u'Niagara Falls'], [u'Buffalo', u'Niagara Falls']]"
19 Aug 2016,,"[[u'Seattle-tacoma International Airport', u'Montreal Airport', u'Seattle-tacoma International Airport', u'Montreal Airport'], [u'Montreal Airport', u'Montreal Airport', u'Montreal Airport', u'Montreal Airport', u'This time has been blocked by you. You can remove/edit this time.', u'Notre-dame Basilica', u'Mosaicultures Internationales']]",22 Aug 2016,"Seattle,Montreal"
20 Aug 2016,57b7cd244e8231483b000463,"[[u'Ottawa, On', u'Montreal, Pq'], [u'Notre-dame Basilica', u'Montreals Underground City', u'Botanical Garden', u'Old Montreal', u'Montreal, Pq', u'Ottawa, On']]",21 Aug 2016," ,Montreal"
08 Aug 2015,,"[[u'Basilique Cathedrale - Notre-dame-de-quebec', u'La Citadelle', u'Choco Musee Erico', u'Chateau Frontenac', u'Casino De Montreal'], [u'Parc De La Chute Montmorency', u'Musee National Des Beaux Arts Or Du Quebec', u'Morrin Centre', u'Haute-ville'], [u'Musee Du Fort', u'Cathedral Of The Holy Trinity', u'Hotel De Glace', u'Fortifications Of Qu\xe9bec National Historic Site'], [u'Lower Town', u'Museum Of French America Or Musee De L\\ameriquefrancaise', u'Observatoire De La Capitale'], [u'Place Royale', u'Musee De La Civilisation', u'Terrasse Dufferin'], [u'Casino De Mont-tremblant', u'Aventures Parc Mont-Tremblant'], [u'Mosaicultures Internationales', u'Notre-dame Basilica']]",14 Aug 2015,"Quebec,Quebec,Quebec,Quebec,Quebec,Mont-tremblant,Montreal"
21 Jul 2015,,"[[u'Old Montreal', u'Chateau Ramezay Museum', u'Notre-dame Basilica'], [u'St Josephs Oratory Of Mount Royal', u'Musee Des Beaux-arts De Montreal', u'Place Des Arts']]",22 Jul 2015,"Montreal,Montreal"
04 Sep 2016,,"[[u'Sugar Land City Center', u'Montreal Airport', u'Auberge Hi-montreal Hostel'], [u'Auberge Hi-montreal Hostel', u'Mosaicultures Internationales', u'Botanical Garden', u'Auberge Hi-montreal Hostel'], [u'Auberge Hi-montreal Hostel', u'Old Montreal', u'Notre-dame Basilica', u'Le Village', u'Auberge Hi-montreal Hostel'], [u'Auberge Hi-montreal Hostel', u'Montreal Airport', u'Sugar Land City Center']]",07 Sep 2016,"Sugar Land,Montreal,Montreal,Sugar Land"
19 Sep 2016,,"[[u'Botanical Garden'], [u'Hotel Y De Montr\xe9al', u'Mosaicultures Internationales', u'Botanical Garden', u'Hotel Y De Montr\xe9al'], [u'Hotel Y De Montr\xe9al']]",21 Sep 2016,"Montreal,Montreal, "
04 Oct 2016,,"[[u'Chhatrapati Shivaji International Airport', u'Buffalo Niagara International Airport'], [u'Buffalo Niagara International Airport', u'Buffalo Niagara International Airport', u'Empress Inn And Suites By The Falls', u'Journey Behind The Falls', u'Niagara Parks Butterfly Conservatory', u'Empress Inn And Suites By The Falls'], [u'Empress Inn And Suites By The Falls', u'Niagara Falls', u'Albright-Knox Art Gallery', u'Empress Inn And Suites By The Falls'], [u'Empress Inn And Suites By The Falls', u'Ripleys Believe It Or Not Museum', u'Niagara Falls City Center', u'Toronto City Center', u'Days Inn - Toronto East Lakeview', u'C N Tower', u'Days Inn - Toronto East Lakeview'], [u'Days Inn - Toronto East Lakeview', u'Toronto Eaton Centre', u'Royal Ontario Museum', u'Days Inn - Toronto East Lakeview'], [u'Days Inn - Toronto East Lakeview', u'Art Gallery Of Ontario Or A G O', u'Hockey Hall Of Fame', u'Toronto Airport', u'Montreal Airport', u'Refuge Du Po\xe8te'], [u'Refuge Du Po\xe8te', u'Mosaicultures Internationales', u'Botanical Garden', u'Le Village', u'Refuge Du Po\xe8te'], [u'Refuge Du Po\xe8te', u'Mont Royal Cemetery', u'Notre-dame Basilica', u'Musee Des Beaux-arts De Montreal', u'Montreal Airport', u'Chhatrapati Shivaji International Airport'], [], [u'Chhatrapati Shivaji International Airport', u'Chhatrapati Shivaji International Airport']]",13 Oct 2016,"[u'Mumbai', u'Niagara Falls', [u'Buffalo', u'Niagara Falls'], [u'Toronto', u'Niagara Falls'], u'Toronto', u'Toronto', u'Montreal', [u'Montreal', u'Mumbai'], ' ', u'Mumbai']"
24 May 2015,,"[[u'Montreal Biodome', u'Old Montreal'], [u'Lorchestre Symphonique De Montreal', u'Botanical Garden']]",25 May 2015,"Montreal,Montreal"
09 Feb 2016,,"[[u'St Josephs Oratory Of Mount Royal', u'Old Montreal'], [u'Mosaicultures Internationales', u'Chateau Ramezay Museum', u'Notre-dame Basilica'], [u'Lorchestre Symphonique De Montreal', u'Mont Royal Cemetery', u'Place Des Arts'], [u'Montreal Biodome', u'Botanical Garden'], [u'Belgo Building', u'Musee Des Beaux-arts De Montreal', u'La Citadelle'], [u'Musee Pointe-a-calliere', u'The Olympic Park']]",16 Feb 2016,"Montreal,Montreal,Montreal,Montreal,Montreal,Montreal"
08 Aug 2016,,"[[u'Amsterdam Airport Schiphol', u'Boston Logan International Airport', u'40berkeley', u'Fenway Park', u'Beacon Hill', u'North End'], [u'40berkeley', u'Freedom Trail', u'Boston Tea Party Ships And Museum', u'Waterfront', u'Public Botanical Garden'], [u'40berkeley', u'Boston City Center', u'New York City City Center', u'Newport Centre', u'Central Park'], [u'Liberty State Park', u'Barrow Mansion', u'Pole Position Raceway', u'Hudson And Manhattan Railroad Powerhouse', u'Radio City Music Hall', u'Rockefeller Center', u'Statue Cruises'], [u'Empire State Building', u'Liberty Landing Marina', u'National 9-11 Memorial Museum', u'Fanaberie', u'Stanley Theatre'], [u'New York City City Center', u'Washington D. C. City Center', u'Tidal Basin', u'Smithsonian Castle', u'Iwo Jima Memorial', u'National Mall'], [u'Washington Monument', u'National Zoological Park', u'Arlington National Cemetery', u'National Museum Of The American Indian', u'Union Station', u'Lincoln Memorial'], [u'United States Capitol', u'US Supreme Court Building', u'Pentagon', u'Library Of Congress', u'World War I I Memorial', u'Vietnam Veterans Memorial', u'Georgetown'], [u'Washington D. C. City Center', u'Toronto City Center', u'Chinatown'], [u'Toronto Eaton Centre', u'Distillery District', u'Centre Island', u'C N Tower'], [u'Casa Loma', u'Art Gallery Of Ontario Or A G O', u'Kensington Market'], [u'Toronto City Center', u'Montreal City Center', u'St Josephs Oratory Of Mount Royal', u'Three Monkeys', u'Circuit Gilles Villeneuve'], [u'Mosaicultures Internationales', u'Canadian Railway Museum', u'Les Bobards', u'Terrasse Dufferin', u'Mount Royal'], [u'Le Village', u'La Citadelle', u'Belgo Building', u'Montreal Airport', u'Boston Logan International Airport', u'Beacon Hill'], [u'Waterfront', u'North End', u'Boston Tea Party Ships And Museum', u'Museum Of Science', u'Boston Public Library', u'Boston Logan International Airport', u'Amsterdam Airport Schiphol'], [u'Amsterdam Airport Schiphol', u'Amsterdam Airport Schiphol']]",23 Aug 2016,"[[u'Amsterdam Airport Schiphol', u'Boston'], u'Boston', [u'New York City', u'Jersey City'], [u'New York City', u'Jersey City'], [u'New York City', u'Jersey City'], [u'New York City', u'Washington D. C.'], u'Washington D. C.', u'Washington D. C.', u'Toronto', u'Toronto', u'Toronto', u'Montreal', [u'Montreal', u'Quebec'], [u'Montreal', u'Boston'], [u'Amsterdam Airport Schiphol', u'Boston'], u'Amsterdam Airport Schiphol']"
23 Oct 2016,,"[[u'Athens International Airport', u'Toronto Airport', u'The Novotel Toronto Centre', u'C N Tower', u'The Novotel Toronto Centre'], [u'The Novotel Toronto Centre', u'Toronto Eaton Centre', u'Royal Ontario Museum', u'The Novotel Toronto Centre'], [u'The Novotel Toronto Centre', u'Casa Loma', u'Art Gallery Of Ontario Or A G O', u'Chinatown', u'The Novotel Toronto Centre'], [u'The Novotel Toronto Centre', u'Centre Island', u'Hockey Hall Of Fame', u'Distillery District', u'The Novotel Toronto Centre'], [u'The Novotel Toronto Centre', u'Toronto Zoo', u'Kensington Market', u'The Novotel Toronto Centre'], [u'The Novotel Toronto Centre', u'Ontario Science Centre', u'The Novotel Toronto Centre'], [u'Toronto, On', u'Ottawa, On', u'Novotel Ottawa', u'Morris Island Conservation Area ', u'Loch March Golf and Country Club ', u'Canadian Golf and Country Club ', u'Manderley On The Green ', u'Novotel Ottawa'], [u'Novotel Ottawa', u'Mooneys Bay Park', u'Garden Of The Provinces and Territories', u'Blue Bamboo Yoga ', u'Novotel Ottawa'], [u'Irish Hills Golf and Country Club ', u'Cumberland Heritage Village Museum ', u'The Meadows Golf and Country Club', u'Ottawa, On', u'Montreal, Pq', u'Hyatt Regency Montreal', u'Le Village', u'Hyatt Regency Montreal'], [u'Hyatt Regency Montreal', u'Mosaicultures Internationales', u'Botanical Garden', u'Hyatt Regency Montreal'], [u'Mont Royal Cemetery', u'Old Montreal', u'Musee Des Beaux-arts De Montreal', u'Montreal Airport', u'Athens International Airport'], [u'Athens International Airport', u'Athens International Airport']]",03 Nov 2016,"[[u'Toronto', u'Athens'], u'Toronto', u'Toronto', u'Toronto', u'Toronto', u'Toronto', u'Ottawa', u'Ottawa', [u'Montreal', u'Ottawa'], u'Montreal', [u'Montreal', u'Athens'], u'Athens']"
16 Sep 2016,57bd00044e8231a168000c81,"[[u'Livingston City Center', u'Montreal City Center', u'Auberge Hi-montreal Hostel', u'Le Village', u'Musee Des Beaux-arts De Montreal', u'Auberge Hi-montreal Hostel'], [u'Auberge Hi-montreal Hostel', u'Mosaicultures Internationales', u'Botanical Garden', u'Auberge Hi-montreal Hostel'], [u'Auberge Hi-montreal Hostel', u'Notre-dame Basilica', u'Auberge Hi-montreal Hostel'], [u'Auberge Hi-montreal Hostel', u'Mont Royal Cemetery', u'Montreal City Center', u'Livingston City Center']]",19 Sep 2016,"Montreal,Montreal,Montreal,Montreal"
22 Aug 2016,,"[[u'New Brunswick, Nj', u'Montreal, Qc'], [u'Mosaicultures Internationales', u'Botanical Garden'], [u'Notre-dame Basilica', u'Musee Des Beaux-arts De Montreal'], [u'Montreal, Pq', u'New Brunswick'], [u'New Brunswick', u'New Brunswick']]",26 Aug 2016," ,Montreal,Montreal, , "
