trip_start_time,author_id,trip_path_detail,trip_end_time,trip_path_city
05 Nov 2016,,"[[u'Bruges City Center', u'Montreal Airport', u'Auberge Saint-paul'], [u'Auberge Saint-paul', u'Mosaicultures Internationales', u'Botanical Garden', u'Auberge Saint-paul'], [u'Auberge Saint-paul', u'Mont Royal Cemetery', u'La Citadelle', u'Montreal Airport', u'Whistler City Center'], [u'Whistler City Center', u'Whistler City Center', u'Hi-whistler', u'Whistler Blackcomb', u'Squamish Lilwat Cultural Centre', u'Whistler Blackcombs Coca-Cola Tube Park', u'Hi-whistler'], [u'Hi-whistler', u'Peak To Peak Gondola', u'Whistler Sliding Centre', u'Whistler Olympic Park', u'Hi-whistler'], [u'Hi-whistler', u'Whistler Kids', u'Whistler City Center', u'Banff City Center'], [u'Banff City Center', u'Banff City Center', u'Banff International Hostel', u'Tunnel Mountain Drive', u'Banff National Park', u'Lake Minnewanka'], [u'Banff International Hostel', u'Banff Visitor Information Centre', u'Bow Falls', u'Parker Ridge Trail', u'Banff International Hostel'], [u'Banff International Hostel', u'Banff Upper Hot Springs', u'Sulphur Mountain', u'Vermilion Lakes', u'Banff International Hostel'], [u'Banff International Hostel', u'Surprise Corner', u'Banff City Center', u'Buffalo Niagara International Airport', u'Empress Inn And Suites By The Falls'], [u'Empress Inn And Suites By The Falls', u'Niagara Falls', u'Skylon Tower', u'Journey Behind The Falls', u'Empress Inn And Suites By The Falls'], [u'Empress Inn And Suites By The Falls', u'Darwin D Martin House', u'Buffalo Zoo', u'Empress Inn And Suites By The Falls'], [u'Empress Inn And Suites By The Falls', u'Niagara Falls City Center', u'St Johns Airport', u'The Duckworth Inn', u'Spirit Of Newfoundland', u'Terry Fox Memorial', u'Johnson Geo Centre', u'Signal Hill', u'The Duckworth Inn'], [u'The Duckworth Inn', u'Cape Spear Lighthouse', u'George Street', u'Basilica Of St. John The Baptist', u'The Rooms', u'Quidi Vidi Lake', u'Pippy Park', u'The Duckworth Inn'], [u'The Duckworth Inn', u'Bowring Park', u'East Coast Trail', u'Inn Of Olde Pub', u'St Johns Airport', u'Bruges City Center'], [u'Bruges City Center', u'Bruges City Center']]",20 Nov 2016,"[' ', u'Montreal', [u'Whistler', u'Montreal'], u'Whistler', u'Whistler', u'Whistler', u'Banff', u'Banff', u'Banff', u'Banff', u'Niagara Falls', u'Buffalo', u'St. Johns', u'St. Johns', u'St. Johns', ' ']"
26 Jul 2016,,"[[u'Kansas City International Airport', u'Toronto Airport', u'Distillery District'], [u'Toronto Eaton Centre', u'Royal Ontario Museum'], [u'C N Tower', u'Casa Loma', u'Toronto, On', u'Montr\xe9al, Qc'], [u'Mosaicultures Internationales', u'Botanical Garden', u'Le Village'], [u'Notre-dame Basilica'], [u'Montr\xe9al, Qc', u'Qu\xe9bec, Qc', u'Basilique Cathedrale - Notre-dame-de-quebec', u'Place Royale', u'Musee De La Civilisation'], [u'La Citadelle', u'Musee Du Fort', u'Musee National Des Beaux Arts Or Du Quebec'], [u'Quebec Airport', u'Kansas City International Airport']]",02 Aug 2016,"[[u'Toronto', u'Kansas City'], u'Toronto', u'Toronto', u'Montreal', u'Montreal', u'Quebec', u'Quebec', u'Kansas City']"
09 Jul 2016,,"[[u'Larnaca International Airport', u'Montreal Airport', u'St Josephs Oratory Of Mount Royal', u'Auberge Du Carre St-louis'], [u'Canadian Railway Museum', u'Belgo Building', u'Terrasse Dufferin', u'Circuit Gilles Villeneuve', u'Auberge Du Carre St-louis'], [u'Notre-dame Basilica', u'Le Village', u'Auberge Du Carre St-louis'], [u'Auberge Du Carre St-louis', u'Montreal Biodome', u'Place Des Arts', u'Montr\xe9al, Qc', u'Kingston', u'Residence Inn By Marriott Kingston Waters Edge', u'Ramada Kingston Hotel And Conference Centre'], [u'Fort Henry', u'Kingston Waterfront', u'Lemoine Point Conservation Area', u'Queens University', u'Residence Inn By Marriott Kingston Waters Edge', u'Ramada Kingston Hotel And Conference Centre'], [u'Lake Ontario Park', u'Correctional Service Of Canada Museum', u'Residence Inn By Marriott Kingston Waters Edge', u'Ramada Kingston Hotel And Conference Centre'], [u'Ramada Kingston Hotel And Conference Centre', u'Residence Inn By Marriott Kingston Waters Edge', u'Howe Island', u'Kingston Airport', u'Windsor Airport', u'Caesars Windsor Hotel And Casino'], [u'Caesars Windsor Hotel And Casino', u'Comerica Park', u'Motown Historical Museum', u'Caesars Windsor', u'Peche Island'], [u'Caesars Windsor Hotel And Casino', u'Windsor Airport', u'Vancouver Airport', u'Blue Horizon Hotel'], [u'Stanley Park', u'Grouse Mountain', u'Queen Elizabeth Park', u'Blue Horizon Hotel'], [u'Blue Horizon Hotel', u'Spanish Banks', u'Vancouver Airport', u'Larnaca International Airport'], [u'Larnaca International Airport', u'Larnaca International Airport']]",20 Jul 2016,"[[u'Larnaca', u'Montreal'], [u'Montreal', u'Quebec'], u'Montreal', u'Montreal', u'Kingston', u'Kingston', u'Kingston', [u'Detroit', u'Windsor'], ' ', u'Vancouver', [u'Vancouver', u'Larnaca'], u'Larnaca']"
10 Nov 2016,,"[[u'Baltimore Airport', u'Montreal Airport', u'Le Square Phillips H\xf4tel and Suites', u'Musee Des Beaux-arts De Montreal', u'Le Village', u'Le Square Phillips H\xf4tel and Suites'], [u'Le Square Phillips H\xf4tel and Suites', u'Mosaicultures Internationales', u'Botanical Garden', u'Le Square Phillips H\xf4tel and Suites'], [u'Le Square Phillips H\xf4tel and Suites', u'Old Montreal', u'Notre-dame Basilica', u'Three Monkeys', u'Les Bobards', u'Le Square Phillips H\xf4tel and Suites'], [u'Le Square Phillips H\xf4tel and Suites', u'Lorchestre Symphonique De Montreal', u'Montreal Airport', u'Baltimore City Center']]",13 Nov 2016,"Montreal,Montreal,Montreal,Montreal"
17 Mar 2017,,"[[u'Eppley Airfield', u'Montreal Airport', u'Hotel Y De Montr\xe9al', u'Montreals Underground City', u'Hotel Y De Montr\xe9al'], [u'Hotel Y De Montr\xe9al', u'Mosaicultures Internationales', u'Botanical Garden', u'Le Village', u'Hotel Y De Montr\xe9al'], [u'Hotel Y De Montr\xe9al', u'Circuit Gilles Villeneuve', u'Chateau Ramezay Museum', u'Notre-dame Basilica', u'Place Des Arts', u'Hotel Y De Montr\xe9al'], [u'Hotel Y De Montr\xe9al', u'Musee Des Beaux-arts De Montreal', u'Three Monkeys', u'Old Montreal', u'Hotel Y De Montr\xe9al'], [u'Hotel Y De Montr\xe9al', u'Mont Royal Cemetery', u'Mount Royal', u'St Josephs Oratory Of Mount Royal', u'Hotel Y De Montr\xe9al'], [u'Hotel Y De Montr\xe9al', u'Lorchestre Symphonique De Montreal', u'The Olympic Park', u'Casino De Montreal', u'Terrasse Dufferin', u'Hotel Y De Montr\xe9al'], [u'Hotel Y De Montr\xe9al', u'La Citadelle', u'Belgo Building', u'Hotel Y De Montr\xe9al'], [u'Hotel Y De Montr\xe9al', u'Canadian Railway Museum', u'Musee Pointe-a-calliere', u'Montreal Airport', u'Eppley Airfield']]",24 Mar 2017,"[u'Montreal', u'Montreal', u'Montreal', u'Montreal', u'Montreal', [u'Montreal', u'Quebec'], u'Montreal', u'Montreal']"
17 Jun 2016,5763572a4e8231844f0002f2,"[[u'Old Montreal', u'Mosaicultures Internationales', u'Chateau Ramezay Museum'], [u'Notre-dame Basilica', u'The Olympic Park', u'Musee Pointe-a-calliere', u'Montreal Biodome'], [u'Montreals Underground City', u'Musee Des Beaux-arts De Montreal', u'Musee Pointe-a-calliere', u'Mount Royal'], [u'La Citadelle', u'Belgo Building', u'Lower Town', u'Chateau Frontenac', u'Observatoire De La Capitale'], [u'Basilique Cathedrale - Notre-dame-de-quebec', u'Musee De La Civilisation', u'Place Royale', u'Observatoire De La Capitale', u'Choco Musee Erico', u'Parc De La Chute Montmorency']]",22 Jun 2016,"[u'Montreal', u'Montreal', u'Montreal', [u'Montreal', u'Quebec'], u'Quebec']"
02 Sep 2016,575eae414e823106210000ce,"[[u'John F. Kennedy International Airport', u'Montreal Airport', u'Musee Des Beaux-arts De Montreal', u'Loews H\xf4tel Vogue', u'Residence Ets', u'Bota Bota, Spa-sur-leau'], [u'Mosaicultures Internationales', u'Botanical Garden', u'Le Village', u'Barroco', u'Loews H\xf4tel Vogue'], [u'Old Montreal', u'Notre-dame Basilica', u'Biosphere Environmental Museum', u'Loews H\xf4tel Vogue'], [u'Loews H\xf4tel Vogue', u'Belgo Building', u'La Citadelle', u'Montreal Airport', u'West Jet']]",05 Sep 2016,"[[u'Montreal', u'New York'], u'Montreal', u'Montreal', [u'New York City', u'Montreal']]"
03 Jan 2016,,"[[u'Canadian Railway Museum', u'Mosaicultures Internationales', u'Circuit Gilles Villeneuve'], [u'Mount Royal', u'Notre-dame Basilica'], [u'Lorchestre Symphonique De Montreal', u'Mont Royal Cemetery', u'Casino De Montreal', u'Les Bobards'], [u'Montreal Biodome', u'Three Monkeys', u'La Citadelle'], [u'Le Village', u'Musee Pointe-a-calliere', u'Musee Des Beaux-arts De Montreal']]",07 Jan 2016,"[u'Montreal', u'Montreal', [u'Montreal', u'Quebec'], u'Montreal', u'Montreal']"
13 Feb 2016,,"[[u'Restaurant Lavenue', u'Old Montreal', u'Notre-dame Basilica']]",13 Feb 2016,Montreal
04 Aug 2016,,"[[u'Whitby City Center', u'Ottawa City Center', u'Royal Canadian Mint', u'Supreme Court Of Canada', u'Canada Aviation And Space Museum', u'Majors Hill Park', u'Garden Of The Provinces and Territories', u'Ottawa City Center', u'Montreal City Center'], [u'Mosaicultures Internationales', u'Montreal Biodome', u'Notre-dame Basilica', u'Mount Royal', u'The Olympic Park', u'Montreal City Center', u'Quebec City Center'], [u'Quebec City Center', u'Quebec City Center', u'Basilique Cathedrale - Notre-dame-de-quebec', u'Museum Of French America Or Musee De L\\ameriquefrancaise', u'Parliament Building', u'Musee Du Fort', u'Musee National Des Beaux Arts Or Du Quebec', u'Battlefield Park ', u'Chateau Frontenac'], [u'Parc De La Chute Montmorency', u'Place Royale', u'La Citadelle', u'Observatoire De La Capitale', u'Aquarium Of Quebec', u'Quebec City Center', u'Whitby City Center'], [u'Whitby City Center', u'Whitby City Center']]",08 Aug 2016,"Ottawa,Montreal,Quebec,Quebec, "
09 Oct 2015,56117d333216f54b2a000a86,"[[u'Old Montreal', u'Chateau Ramezay Museum', u'Notre-dame Basilica'], [u'St Josephs Oratory Of Mount Royal', u'Musee Des Beaux-arts De Montreal', u'Place Des Arts']]",10 Oct 2015,"Montreal,Montreal"
25 Nov 2016,,"[[u'Total Airport Services', u'Montreal Airport', u'Auberge Hi-montreal Hostel', u'The Olympic Park'], [u'Auberge Hi-montreal Hostel', u'Mosaicultures Internationales', u'Botanical Garden', u'Auberge Hi-montreal Hostel', u'Musee Des Beaux-arts De Montreal'], [u'Auberge Hi-montreal Hostel', u'Mont Royal Cemetery', u'Notre-dame Basilica', u'Montreal City Center', u'Quebec City Center', u'Auberge Internationale De Quebec', u'Haute-ville', u'Auberge Internationale De Quebec'], [u'Auberge Internationale De Quebec', u'Chateau Frontenac', u'Parliament Building', u'La Citadelle', u'Fortifications Of Qu\xe9bec National Historic Site', u'Quartier Du Petit Champlain', u'Auberge Internationale De Quebec'], [u'Auberge Internationale De Quebec', u'Basilique Cathedrale - Notre-dame-de-quebec', u'Musee De La Civilisation', u'Place Royale', u'Morrin Centre', u'Auberge Internationale De Quebec'], [u'Auberge Internationale De Quebec', u'Battlefield Park ', u'Cathedral Of The Holy Trinity', u'Musee National Des Beaux Arts Or Du Quebec', u'Musee Des Ursuline De Quebec', u'Lower Town', u'Auberge Internationale De Quebec'], [u'Auberge Internationale De Quebec', u'Hotel De Glace', u'Musee Du Fort', u'Museum Of French America Or Musee De L\\ameriquefrancaise', u'Terrasse Dufferin', u'Auberge Internationale De Quebec'], [u'Auberge Internationale De Quebec', u'Aquarium Of Quebec', u'Musee Naval De Quebec', u'Parc De La Chute Montmorency', u'Parc National De La Jacques Cartier', u'Auberge Internationale De Quebec'], [u'Auberge Internationale De Quebec', u'Casino De Montreal', u'Choco Musee Erico', u'Quebec Airport', u'Total Airport Services']]",03 Dec 2016,"[[u'Los Angeles', u'Montreal'], u'Montreal', [u'Montreal', u'Quebec'], u'Quebec', u'Quebec', u'Quebec', u'Quebec', u'Quebec', [u'Los Angeles', u'Quebec']]"
21 Feb 2016,,"[[u'Parc National De La Jacques Cartier', u'Parc De La Chute Montmorency', u'Quartier Du Petit Champlain', u'Choco Musee Erico'], [u'Mount Royal', u'Belgo Building', u'Chateau Frontenac', u'Basilique Cathedrale - Notre-dame-de-quebec'], [u'Lower Town', u'Le Village', u'Musee National Des Beaux Arts Or Du Quebec'], [u'Montreal Biodome', u'Musee Des Beaux-arts De Montreal', u'Haute-ville', u'Les Bobards', u'Terrasse Dufferin']]",24 Feb 2016,"[u'Quebec', [u'Montreal', u'Quebec'], [u'Montreal', u'Quebec'], [u'Montreal', u'Quebec']]"
08 Apr 2016,,"[[u'Winnipeg Airport', u'Montreal Airport', u'Holiday Inn Montreal Centre Ville Downtown', u'Souvenir Du Qu\xe9bec', u'Old Montreal', u'Anger Ink \u2022 Montreal Tattoo Shop', u'Dunns Famous'], [u'Holiday Inn Montreal Centre Ville Downtown', u'The Olympic Park', u'Montreal Biodome', u'Notre-dame-des-neiges', u'Centre Bell Boutique Souvenirs', u'Burger Bar Crescent', u'Centre Bell', u'Notre-dame Basilica'], [u'Montreal Airport', u'Winnipeg Airport']]",10 Apr 2016,"Montreal,Montreal, "
27 Apr 2016,571539444e82318431001b10,"[[u'Rochester City Center', u'Montreal City Center', u'Hotel Travelodge Montreal Centre', u'Circuit Gilles Villeneuve', u'Three Monkeys', u'Terrasse Dufferin'], [u'Hotel Travelodge Montreal Centre', u'Mount Royal', u'St Josephs Oratory Of Mount Royal', u'Belgo Building', u'Les Bobards', u'Montreals Underground City'], [u'Hotel Travelodge Montreal Centre', u'Mont Royal Cemetery', u'Musee Pointe-a-calliere', u'Place Des Arts', u'Chateau Ramezay Museum', u'Le Village'], [u'Hotel Travelodge Montreal Centre'], [u'The Olympic Park', u'Hotel Travelodge Montreal Centre', u'Montreal City Center', u'Rochester City Center']]",01 May 2016,"[[u'Montreal', u'Quebec'], u'Montreal', u'Montreal', ' ', u'Montreal']"
16 Jul 2016,,"[[u'Miguel Hidalgo Y Costilla International Airport', u'Montreal Airport', u'Auberge Hi-montreal Hostel'], [u'Auberge Hi-montreal Hostel', u'Mosaicultures Internationales', u'Mont Royal Cemetery'], [u'Montreal City Center', u'Quebec City Center', u'Auberge Jeunesse \xe0 Loulou', u'Parliament Building', u'Haute-ville', u'Battlefield Park ', u'Chateau Frontenac', u'Terrasse Dufferin', u'Lower Town'], [u'Auberge Jeunesse \xe0 Loulou', u'Place Royale', u'La Citadelle', u'Musee De La Civilisation', u'Morrin Centre', u'Quartier Du Petit Champlain', u'Hotel De Glace'], [u'Auberge Jeunesse \xe0 Loulou', u'Basilique Cathedrale - Notre-dame-de-quebec', u'Observatoire De La Capitale', u'Musee Du Fort', u'Musee Des Ursuline De Quebec', u'Parc National De La Jacques Cartier', u'Parc De La Chute Montmorency'], [u'Aquarium Of Quebec', u'Botanical Garden', u'Notre-dame Basilica', u'Casino De Montreal', u'Quebec Airport', u'Toronto Airport', u'Victoria Park Family Home'], [u'Victoria Park Family Home', u'Toronto Eaton Centre', u'Hockey Hall Of Fame', u'Chinatown'], [u'Victoria Park Family Home', u'C N Tower', u'Art Gallery Of Ontario Or A G O', u'Centre Island'], [u'Toronto City Center', u'Niagara Falls City Center', u'Courtyard By Marriott Niagara Falls', u'Skylon Tower', u'Buffalo And Erie County Naval And Military Park', u'Albright-Knox Art Gallery', u'Niagara Falls'], [u'Courtyard By Marriott Niagara Falls', u'Buffalo Zoo', u'Journey Behind The Falls', u'Bird Kingdom', u'Ripleys Believe It Or Not Museum'], [u'Courtyard By Marriott Niagara Falls', u'Niagara Falls City Center', u'Miguel Hidalgo Y Costilla International Airport']]",26 Jul 2016,"[u'Guadalajara', u'Montreal', u'Quebec', u'Quebec', u'Quebec', [u'Montreal', u'Quebec'], u'Toronto', u'Toronto', [u'Buffalo', u'Niagara Falls'], [u'Buffalo', u'Niagara Falls'], u'Guadalajara']"
30 Oct 2016,,"[[u'Middle Grove City Center', u'Montreal City Center', u'Hotel Y De Montr\xe9al', u'Musee Des Beaux-arts De Montreal', u'Old Montreal', u'Hotel Y De Montr\xe9al'], [u'Hotel Y De Montr\xe9al', u'Botanical Garden', u'Hotel Y De Montr\xe9al'], [u'Hotel Y De Montr\xe9al', u'Belgo Building', u'Notre-dame Basilica', u'Montreal City Center', u'Middle Grove City Center']]",01 Nov 2016,"[[u'Montreal', u'Middle Grove'], u'Montreal', [u'Montreal', u'Middle Grove']]"
08 Nov 2016,,"[[u'New York La Guardia Airport', u'Montreal Airport', u'Auberge Hi-montreal Hostel', u'Three Monkeys', u'Auberge Hi-montreal Hostel'], [u'Auberge Hi-montreal Hostel', u'Mosaicultures Internationales', u'Botanical Garden', u'Le Village', u'Auberge Hi-montreal Hostel'], [u'Auberge Hi-montreal Hostel', u'Old Montreal', u'Notre-dame Basilica', u'Musee Des Beaux-arts De Montreal', u'Auberge Hi-montreal Hostel'], [u'Auberge Hi-montreal Hostel', u'Belgo Building', u'Montreal Airport', u'New York La Guardia Airport']]",11 Nov 2016,"Montreal,Montreal,Montreal,Montreal"
22 Sep 2016,,"[[u'Austin-bergstrom International Airport', u'Montreal Airport'], [u'Montreal Airport', u'Montreal Airport', u'Bandb Bleu Balcon', u'St Josephs Oratory Of Mount Royal', u'La Citadelle', u'Three Monkeys', u'Le Village', u'Bandb Bleu Balcon'], [u'Bandb Bleu Balcon', u'Mosaicultures Internationales', u'Botanical Garden', u'Les Bobards', u'Bandb Bleu Balcon'], [u'Bandb Bleu Balcon', u'Notre-dame Basilica', u'Place Des Arts', u'Bandb Bleu Balcon'], [u'Bandb Bleu Balcon', u'Circuit Gilles Villeneuve', u'Musee Des Beaux-arts De Montreal', u'Old Montreal', u'Montreal City Center', u'Quebec City Center'], [u'Quebec City Center', u'Quebec City Center', u'Hotel Hippocampe - Men Only', u'Parliament Building', u'Fortifications Of Qu\xe9bec National Historic Site', u'Musee Du Fort', u'Museum Of French America Or Musee De L\\ameriquefrancaise', u'Quartier Du Petit Champlain', u'Hotel Hippocampe - Men Only'], [u'Hotel Hippocampe - Men Only', u'Basilique Cathedrale - Notre-dame-de-quebec', u'La Citadelle', u'Musee Des Ursuline De Quebec', u'Cathedral Of The Holy Trinity', u'Morrin Centre', u'Hotel Hippocampe - Men Only'], [u'Hotel Hippocampe - Men Only', u'Chateau Frontenac', u'Haute-ville', u'Musee De La Civilisation', u'Musee Naval De Quebec', u'Choco Musee Erico', u'Lower Town', u'Hotel Hippocampe - Men Only'], [u'Hotel Hippocampe - Men Only', u'Place Royale', u'Observatoire De La Capitale', u'Battlefield Park ', u'Parc De La Chute Montmorency', u'Hotel Hippocampe - Men Only'], [u'Hotel Hippocampe - Men Only', u'Aquarium Of Quebec', u'Musee National Des Beaux Arts Or Du Quebec', u'Hotel De Glace', u'Ice Hotel', u'Hotel Hippocampe - Men Only'], [u'Hotel Hippocampe - Men Only', u'Quebec Airport', u'Austin-bergstrom International Airport']]",02 Oct 2016," ,Montreal,Montreal,Montreal,Montreal,Quebec,Quebec,Quebec,Quebec,Quebec, "
22 Sep 2015,,[[u'Old Montreal']],27 Sep 2015,Montreal
23 Mar 2016,,"[[u'Kitchener City Center', u'Montreal Airport', u'Sofitel Montreal Golden Mile', u'Canadian Railway Museum', u'St Josephs Oratory Of Mount Royal', u'Three Monkeys', u'Chateau Ramezay Museum', u'Circuit Gilles Villeneuve'], [u'Sofitel Montreal Golden Mile', u'Mount Royal', u'Musee Pointe-a-calliere', u'Les Bobards', u'Notre-dame Basilica'], [u'Sofitel Montreal Golden Mile', u'Mosaicultures Internationales', u'The Olympic Park', u'Terrasse Dufferin', u'Musee Des Beaux-arts De Montreal', u'Le Village'], [u'Sofitel Montreal Golden Mile', u'Montreal Airport', u'Kitchener City Center']]",26 Mar 2016,"[[u'Kitchener', u'Montreal'], u'Montreal', [u'Montreal', u'Quebec'], u'Kitchener']"
24 Jul 2016,,"[[u'Owen Sound City Center', u'Ottawa City Center', u'The Business Inn', u'Canadian Museum Of Nature', u'Garden Of The Provinces and Territories', u'Majors Hill Park', u'Midway Family Fun Park'], [u'The Business Inn', u'Mooneys Bay Park', u'Canada Agriculture And Food Museum', u'TD Place Stadium', u'National Arts Centre', u'National Gallery Of Canada', u'Notre Dame Basilica', u'Bytown Museum', u'The Meadows Golf and Country Club', u'Manderley On The Green '], [u'The Business Inn', u'Loch March Golf and Country Club ', u'Greensmere Golf and Country Club ', u'Canadian Golf and Country Club ', u'Riverbend Golf and Country Club ', u'Glen Mar Golf and Country Club ', u'Blue Bamboo Yoga ', u'Great Canadian Theatre Company', u'Osgoode Township Historical Society and Museum', u'Ottawa, On', u'Montreal, Pq', u'Hotel Zero 1 Montreal', u'Three Monkeys'], [u'Hotel Zero 1 Montreal', u'Mosaicultures Internationales', u'Botanical Garden', u'Le Village', u'Les Bobards'], [u'Hotel Zero 1 Montreal', u'Mont Royal Cemetery', u'La Citadelle', u'St Josephs Oratory Of Mount Royal', u'Musee Des Beaux-arts De Montreal', u'Montreal Airport', u'Owen Sound City Center'], [u'Owen Sound City Center', u'Owen Sound City Center']]",29 Jul 2016,"[[u'Ottawa', u'Owen Sound'], u'Ottawa', [u'Montreal', u'Ottawa'], u'Montreal', [u'Montreal', u'Owen Sound'], u'Owen Sound']"
23 Oct 2015,55886297fbc2e500520008a6,"[[u'Old Montreal', u'Notre-dame Basilica', u'Montreals Underground City', u'Montr\xe9al-Pierre Elliott Trudeau International Airport']]",23 Oct 2015,Montreal
10 Feb 2016,,"[[u'Diefenbunker - Canadas Cold War Museum ', u'Notre Dame Basilica', u'Midway Family Fun Park', u'Majors Hill Park', u'Rideau Hall', u'Rideau Canal'], [u'Parc De La Chute Montmorency', u'Musee De La Civilisation', u'Morrin Centre', u'Chateau Frontenac'], [u'St Josephs Oratory Of Mount Royal', u'Mosaicultures Internationales', u'Musee Des Beaux-arts De Montreal'], [u'Lorchestre Symphonique De Montreal', u'Botanical Garden'], [u'Montreal Biodome', u'The Olympic Park']]",14 Feb 2016,"Ottawa,Quebec,Montreal,Montreal,Montreal"
12 Feb 2016,,"[[u'Old Montreal', u'Notre-dame Basilica'], [u'Mosaicultures Internationales', u'Musee Des Beaux-arts De Montreal', u'Place Des Arts'], [u'Montreal Biodome', u'Botanical Garden'], [u'Parc De La Chute Montmorency', u'Musee Du Fort', u'Chateau Frontenac', u'Morrin Centre']]",15 Feb 2016,"Montreal,Montreal,Montreal,Quebec"
17 Jan 2016,,"[[u'Le Relais Lyonnais', u'Botanical Garden', u'Mosaicultures Internationales', u'Musee Des Beaux-arts De Montreal'], [u'Le Relais Lyonnais']]",18 Jan 2016,"Montreal, "
19 Jan 2016,,"[[u'Old Montreal', u'Notre-dame Basilica'], [u'Mosaicultures Internationales', u'Musee Des Beaux-arts De Montreal', u'Place Des Arts'], [u'Montreal Biodome', u'Botanical Garden']]",21 Jan 2016,"Montreal,Montreal,Montreal"
05 May 2016,,"[[u'O|Hare International Airport', u'Montreal Airport', u'Canadian Railway Museum', u'St Josephs Oratory Of Mount Royal', u'Three Monkeys'], [u'Mosaicultures Internationales', u'Place Des Arts', u'Belgo Building', u'Circuit Gilles Villeneuve', u'Les Bobards', u'Musee Des Beaux-arts De Montreal', u'Terrasse Dufferin'], [u'Botanical Garden', u'Mount Royal', u'Montreals Underground City'], [u'La Citadelle', u'Notre-dame Basilica', u'Le Village', u'Casino De Montreal'], [u'Montreal Airport', u'O|Hare International Airport']]",09 May 2016,"[[u'Montreal', u'Chicago'], [u'Montreal', u'Quebec'], u'Montreal', [u'Montreal', u'Quebec'], u'Chicago']"
18 Oct 2016,,"[[u'Murtala Muhammed International Airport', u'Toronto Island Airport', u'Best Western Roehampton Hotel and Suites'], [u'Best Western Roehampton Hotel and Suites', u'Toronto Eaton Centre', u'Art Gallery Of Ontario Or A G O', u'Best Western Roehampton Hotel and Suites'], [u'Best Western Roehampton Hotel and Suites', u'C N Tower', u'Hockey Hall Of Fame', u'Distillery District', u'Centre Island', u'Best Western Roehampton Hotel and Suites'], [u'Best Western Roehampton Hotel and Suites', u'Casa Loma', u'Chinatown', u'Toronto Airport', u'Montreal Airport'], [u'Montreal Airport', u'Montreal Airport', u'Auberge Hi-montreal Hostel', u'Le Village', u'Belgo Building', u'Old Montreal', u'Auberge Hi-montreal Hostel'], [u'Auberge Hi-montreal Hostel', u'Mosaicultures Internationales', u'Botanical Garden', u'Les Bobards', u'Three Monkeys', u'Auberge Hi-montreal Hostel'], [u'Auberge Hi-montreal Hostel', u'Mont Royal Cemetery', u'La Citadelle', u'Montreal Airport', u'Murtala Muhammed International Airport'], [u'Murtala Muhammed International Airport', u'Murtala Muhammed International Airport']]",25 Oct 2016,"[u'Lagos', u'Toronto', u'Toronto', u'Toronto', u'Montreal', u'Montreal', [u'Montreal', u'Lagos'], u'Lagos']"
06 Jan 2017,563ada135d31b91946000ef0,"[[u'Musee Des Beaux-arts De Montreal', u'Notre-dame Basilica']]",06 Jan 2017,Montreal
26 Jun 2016,,"[[u'Agra City Center', u'Montreal Airport', u'Hotel Zero 1 Montreal'], [u'Hotel Zero 1 Montreal', u'Mosaicultures Internationales', u'Botanical Garden', u'Le Village', u'Three Monkeys'], [u'Hotel Zero 1 Montreal', u'Mont Royal Cemetery', u'Belgo Building', u'La Citadelle', u'St Josephs Oratory Of Mount Royal', u'Les Bobards', u'Montreal Airport', u'Agra City Center'], [], [u'Agra City Center', u'Agra City Center']]",30 Jun 2016," ,Montreal,Montreal, , "
27 Jun 2016,,"[[u'Agra City Center', u'Montreal Airport', u'Hotel Zero 1 Montreal'], [u'Hotel Zero 1 Montreal', u'Mosaicultures Internationales', u'Botanical Garden', u'Le Village', u'Three Monkeys'], [u'Hotel Zero 1 Montreal', u'Notre-dame Basilica', u'Belgo Building', u'Old Montreal', u'Les Bobards', u'Musee Des Beaux-arts De Montreal', u'Montreal Airport', u'Agra City Center'], [], [u'Agra City Center', u'Agra City Center']]",01 Jul 2016," ,Montreal,Montreal, , "
