trip_start_time,author_id,trip_path_detail,trip_end_time,trip_path_city
17 Sep 2016,565500469bd33e4104000007,"[[u'Toronto Eaton Centre', u'Distillery District', u'Chinatown', u'Centre Island'], [u'C N Tower', u'Art Gallery Of Ontario Or A G O', u'Kensington Market'], [u'Casa Loma', u'Hockey Hall Of Fame'], [u'Royal Ontario Museum'], [u'Toronto Zoo'], [u'Ontario Science Centre'], [u'Toronto, On', u'Kingston, On', u'Holiday Inn Kingston - Waterfront', u'Kingston Waterfront', u'Lemoine Point Conservation Area', u'Queens University', u'Lake Ontario Park', u'Wolfe Islander III'], [u'Holiday Inn Kingston - Waterfront', u'Howe Island', u'K - Rock Centre'], [u'Holiday Inn Kingston - Waterfront', u'Kingston', u'Montr\xe9al, Qc', u'Hotel Travelodge Montreal Centre', u'Le Village'], [u'Hotel Travelodge Montreal Centre', u'Mont Royal Cemetery', u'Notre-dame Basilica'], [u'Old Montreal', u'Lorchestre Symphonique De Montreal', u'Hotel Travelodge Montreal Centre', u'Montreal City Center', u'Quebec City Center', u'H\xf4tel Manoir De Lesplanade', u'Parc De La Chute Montmorency'], [u'H\xf4tel Manoir De Lesplanade', u'Casino De Montreal', u'Battlefield Park ', u'Haute-ville', u'Chateau Frontenac', u'Terrasse Dufferin'], [u'H\xf4tel Manoir De Lesplanade', u'Hotel De Glace', u'Quartier Du Petit Champlain', u'Lower Town', u'Parliament Building', u'Morrin Centre', u'Parc National De La Jacques Cartier'], [u'H\xf4tel Manoir De Lesplanade', u'Basilique Cathedrale - Notre-dame-de-quebec', u'Museum Of French America Or Musee De L\\ameriquefrancaise', u'Musee Du Fort', u'Place Royale', u'Cathedral Of The Holy Trinity', u'Choco Musee Erico'], [u'H\xf4tel Manoir De Lesplanade', u'Quebec Airport', u'Buffalo Niagara International Airport', u'Courtyard By Marriott Niagara Falls', u'Skylon Tower'], [u'Courtyard By Marriott Niagara Falls', u'Niagara Falls', u'Buffalo Zoo', u'Albright-Knox Art Gallery'], [u'St Lawrence Market', u'Courtyard By Marriott Niagara Falls', u'Niagara Falls City Center', u'Toronto City Center', u'The Parkway Place Guesthouse'], [u'The Parkway Place Guesthouse'], [u'The Parkway Place Guesthouse']]",05 Oct 2016,"[u'Toronto', u'Toronto', u'Toronto', u'Toronto', u'Toronto', u'Toronto', u'Kingston', u'Kingston', u'Montreal', u'Montreal', [u'Montreal', u'Quebec'], u'Quebec', u'Quebec', u'Quebec', u'Niagara Falls', [u'Buffalo', u'Niagara Falls'], u'Toronto', ' ', ' ']"
02 Apr 2016,,"[[u'Hartsfield-Jackson Atlanta International Airport', u'Montreal Airport', u'Circuit Gilles Villeneuve', u'Three Monkeys', u'Terrasse Dufferin', u'Les Bobards', u'Intercontinental Montreal'], [u'Mosaicultures Internationales', u'Canadian Railway Museum', u'Belgo Building', u'Chateau Ramezay Museum', u'Montreals Underground City', u'Intercontinental Montreal'], [u'Botanical Garden', u'Mount Royal', u'Le Village', u'Intercontinental Montreal'], [u'Notre-dame Basilica', u'Casino De Montreal', u'Intercontinental Montreal'], [u'Musee Des Beaux-arts De Montreal', u'St Josephs Oratory Of Mount Royal', u'Intercontinental Montreal'], [u'Mont Royal Cemetery', u'Montreal Biodome', u'Place Des Arts', u'Intercontinental Montreal'], [u'Old Montreal', u'Musee Pointe-a-calliere', u'Intercontinental Montreal']]",08 Apr 2016,"[[u'Montreal', u'Quebec', u'Atlanta'], u'Montreal', u'Montreal', [u'Montreal', u'Quebec'], u'Montreal', u'Montreal', u'Montreal']"
08 Aug 2016,575623de4e8231dc590000c3,"[[u'Huron City Center', u'Montreal City Center'], [u'Montreal City Center', u'Montreal City Center', u'Hotel Travelodge Montreal Centre', u'Notre-dame Basilica', u'Mont Royal Cemetery'], [u'Hotel Travelodge Montreal Centre', u'Montreal City Center', u'Quebec City Center', u'H\xf4tel Manoir De Lesplanade', u'Fortifications Of Qu\xe9bec National Historic Site', u'Basilique Cathedrale - Notre-dame-de-quebec', u'Quartier Du Petit Champlain', u'Chateau Frontenac', u'Lower Town'], [u'H\xf4tel Manoir De Lesplanade', u'Place Royale', u'La Citadelle', u'Musee Du Fort', u'Musee National Des Beaux Arts Or Du Quebec'], [u'H\xf4tel Manoir De Lesplanade', u'Musee De La Civilisation', u'Museum Of French America Or Musee De L\\ameriquefrancaise', u'Quebec City Center', u'Toronto City Center'], [u'Toronto City Center', u'Toronto City Center', u'Best Western Roehampton Hotel and Suites', u'Casa Loma', u'Toronto Eaton Centre', u'C N Tower'], [u'Best Western Roehampton Hotel and Suites', u'Toronto City Center', u'Huron City Center']]",14 Aug 2016," ,Montreal,Quebec,Quebec,Quebec,Toronto, "
07 Aug 2015,559176f1f9c2e5dc5400001d,"[[u'Casino De Mont-tremblant', u'Aventures Parc Mont-Tremblant'], [u'La Citadelle', u'Observatoire De La Capitale', u'Casino De Montreal', u'Chateau Frontenac', u'Choco Musee Erico'], [u'Parc De La Chute Montmorency', u'Morrin Centre', u'Fortifications Of Qu\xe9bec National Historic Site', u'Haute-ville'], [u'Place Royale', u'Musee Des Ursuline De Quebec', u'Musee National Des Beaux Arts Or Du Quebec', u'Hotel De Glace'], [u'Battlefield Park ', u'Lower Town', u'Museum Of French America Or Musee De L\\ameriquefrancaise'], [u'Basilique Cathedrale - Notre-dame-de-quebec', u'Musee De La Civilisation', u'Terrasse Dufferin'], [u'Parc National De La Jacques Cartier', u'Musee Du Fort', u'Cathedral Of The Holy Trinity', u'Parliament Building', u'Musee Naval De Quebec'], [u'Old Montreal', u'Chateau Ramezay Museum', u'Three Monkeys', u'Musee Des Beaux-arts De Montreal']]",14 Aug 2015,"Mont-tremblant,Quebec,Quebec,Quebec,Quebec,Quebec,Quebec,Montreal"
01 Mar 2016,,"[[u'Chelsea Market', u'Empire State Building', u'The Metropolitan Museum Of Art', u'Yankee Stadium'], [u'Central Park', u'Statue Of Liberty', u'Housing Works'], [u'Canadian Railway Museum', u'Mosaicultures Internationales', u'Circuit Gilles Villeneuve'], [u'Mount Royal', u'Notre-dame Basilica'], [u'Lorchestre Symphonique De Montreal', u'Mont Royal Cemetery', u'Casino De Montreal', u'Les Bobards'], [u'Montreal Biodome', u'Three Monkeys', u'La Citadelle'], [u'Le Village', u'Musee Pointe-a-calliere', u'Musee Des Beaux-arts De Montreal'], [u'Musee D Orsay', u'Relais Hotel Vieux Paris', u'Gare Du Nord'], [u'Towers Of Notre Dame Cathedral', u'Bateaux Parisiens River Cruise', u'Place De La Concorde', u'Champs Elysees', u'Tour Montparnasse'], [u'Louvre Pyramid', u'Eiffel Tower', u'Shakespeare And Company Bookstore'], [u'Les Deux Magots', u'Luxembourg Gardens', u'Musee De L Orangerie', u'River Seine'], [u'Montmartre'], [u'Hassan Ii Mosque'], [u'Nairobi National Park', u'Nairobi Java House', u'David Sheldrick Wildlife Trust Or Sheldrick Elephant Orphanage'], [u'Giraffe Center', u'Nairobi Mamba Village'], [u'Uhuru Gardens Memorial Park', u'Bomas Of Kenya', u'African Heritage House'], [u'Karen Blixen Museum', u'Kibera', u'Aero Club Of East Africa'], [u'Nairobi National Museum', u'Imax', u'Nairobi Arboretum'], [u'Paradise Lost', u'Jamia Mosque', u'Snake Park'], [u'Karen Blixen Coffee Garden And Cottages', u'Nairobi Gallery', u'Galleria', u'Finix Casino']]",13 Apr 2016,"[u'New York City', [u'New York City', u'New York'], u'Montreal', u'Montreal', [u'Montreal', u'Quebec'], u'Montreal', u'Montreal', u'Paris', u'Paris', u'Paris', u'Paris', u'Paris', u'Casablanca', u'Nairobi', u'Nairobi', u'Nairobi', u'Nairobi', u'Nairobi', u'Nairobi', u'Nairobi']"
07 Aug 2016,56a9060fb969280f0b0008f5,"[[u'Grand Central Terminal', u'American Ballet Theater', u'The Metropolitan Museum Of Art', u'Fanaberie', u'United Nations Headquarters'], [u'Brooklyn Bridge', u'Flatiron Building', u'Statue Of Liberty', u'American Museum Of Natural History'], [u'Brooklyn Heights Promenade', u'Radio City Music Hall'], [u'Mount Hope Cemetery', u'Hollywood Casino Hotel And Raceway ', u'Paul Bunyan Statue', u'Bangor Mall', u'Cole Land Transportation Museum'], [u'Blackbeards Park', u'Bangor Public Library', u'Cascade Park'], [u'Diamonds Gentlemens Club', u'Darlings Waterfront Pavillion', u'Stephen Kings House', u'Maine Discovery Museum'], [u'Montreal Biodome', u'Botanical Garden', u'3476 Rue Dorion'], [u'R\xe9gine Caf\xe9', u'Mosaicultures Internationales', u'Notre-dame Basilica'], [u'Restaurant Lavenue', u'Old Montreal', u'Musee Des Beaux-arts De Montreal', u'Schwartzs Restaurant'], [u'Hockey Hall Of Fame', u'Distillery District', u'Centre Island'], [u'Toronto Zoo', u'C N Tower'], [u'Chinatown', u'Royal Ontario Museum', u'Kensington Market'], [u'Darwin D Martin House', u'Niagara Glen Nature Reserve', u'Bird Kingdom', u'Ripleys Believe It Or Not Museum'], [u'Liberty Building', u'Niagara Falls', u'The Whirlpool Aero Car', u'Niagara Parks Butterfly Conservatory']]",20 Aug 2016,"[[u'New York City', u'New York'], u'New York City', u'New York City', u'Bangor', u'Bangor', u'Bangor', u'Montreal', u'Montreal', u'Montreal', u'Toronto', u'Toronto', u'Toronto', [u'Buffalo', u'Niagara Falls'], [u'Buffalo', u'Niagara Falls']]"
02 Jun 2016,573db9738427a53347000f22,"[[u'Edmonton Airport', u'Winnipeg Airport', u'Best Western Plus Downtown Winnipeg', u'Assiniboine Park'], [u'Best Western Plus Downtown Winnipeg', u'Assiniboine Park Zoo', u'The Forks National Historic Site', u'Royal Canadian Mint', u'Tinkertown Family Fun Park', u'Winnipeg Art Gallery'], [u'Best Western Plus Downtown Winnipeg', u'Manitoba Legislative Museum', u'Manitoba Museum', u'Fort Whyte', u'Shaw Park'], [u'Best Western Plus Downtown Winnipeg', u'Centennial Concert Hall', u'Winnipeg Airport', u'Montreal Airport', u'Hotel Travelodge Montreal Centre', u'Le Village'], [u'Hotel Travelodge Montreal Centre', u'Mosaicultures Internationales', u'La Citadelle'], [u'Hotel Travelodge Montreal Centre', u'Montreal Airport', u'Whitehorse Airport'], [u'Whitehorse Airport', u'Whitehorse Airport', u'Days Inn Whitehorse', u'Copperbelt Railway And Mining Museum', u'Old Log Church Museum', u'Canada Games Centre', u'Whitehorse Fishway', u'Mountain View Golf Club', u'Emerald Lake'], [u'Days Inn Whitehorse', u'Yukon Transportation Museum', u'Miles Canyon', u'Kwanlin Dun Cultural Centre', u'MacBride Museum', u'Yukon Wildlife Preserve', u'North End Gallery', u'Yukon Beringia Interpretive Centre'], [u'Days Inn Whitehorse', u'S.S. Klondike'], [u'Days Inn Whitehorse', u'Whitehorse Airport', u'Toronto Airport'], [u'Toronto Airport', u'Toronto Airport']]",12 Jun 2016,"[u'Winnipeg', u'Winnipeg', u'Winnipeg', [u'Winnipeg', u'Montreal'], u'Montreal', ' ', u'Whitehorse', u'Whitehorse', u'Whitehorse', ' ', ' ']"
16 Sep 2016,565500469bd33e4104000007,"[[u'Toronto Eaton Centre', u'Distillery District', u'Chinatown', u'Centre Island'], [u'C N Tower', u'Art Gallery Of Ontario Or A G O', u'Kensington Market'], [u'Casa Loma', u'Hockey Hall Of Fame'], [u'Royal Ontario Museum'], [u'Toronto Zoo'], [u'Toronto, On', u'Kingston, On', u'Holiday Inn Kingston - Waterfront', u'Kingston Waterfront', u'Lemoine Point Conservation Area', u'Queens University', u'Lake Ontario Park', u'Wolfe Islander III'], [u'Holiday Inn Kingston - Waterfront', u'City Hall', u'Howe Island'], [u'Holiday Inn Kingston - Waterfront', u'Kingston', u'Montr\xe9al, Qc', u'Mosaicultures Internationales', u'Le Village', u'Musee Des Beaux-arts De Montreal'], [u'Botanical Garden'], [u'Notre-dame Basilica'], [u'Montreal City Center', u'Quebec City Center', u'H\xf4tel Manoir De Lesplanade', u'Parliament Building', u'Haute-ville', u'Battlefield Park ', u'Chateau Frontenac', u'Terrasse Dufferin', u'Lower Town'], [u'H\xf4tel Manoir De Lesplanade', u'Casino De Montreal', u'Place Royale', u'Observatoire De La Capitale', u'Morrin Centre', u'Quartier Du Petit Champlain', u'Hotel De Glace'], [u'H\xf4tel Manoir De Lesplanade', u'Parc National De La Jacques Cartier', u'Cathedral Of The Holy Trinity', u'Musee Du Fort', u'Musee Des Ursuline De Quebec', u'Choco Musee Erico', u'Parc De La Chute Montmorency'], [u'Basilique Cathedrale - Notre-dame-de-quebec', u'Museum Of French America Or Musee De L\\ameriquefrancaise', u'H\xf4tel Manoir De Lesplanade', u'Quebec Airport', u'Ottawa Airport', u'The Business Inn', u'Manderley On The Green ', u'Canadian Museum Of Nature'], [u'The Business Inn', u'Greensmere Golf and Country Club ', u'Notre Dame Basilica', u'Canadian War Museum', u'Billings Estate Museum', u'National Gallery Of Canada', u'Midway Family Fun Park', u'Canada Agriculture And Food Museum', u'National Arts Centre', u'Majors Hill Park', u'Canadian Tire Centre', u'Strathcona Park', u'Great Canadian Theatre Company'], [u'The Business Inn', u'Riverbend Golf and Country Club ', u'Loch March Golf and Country Club ', u'Cumberland Heritage Village Museum ', u'Richmond Centennial Golf Course ', u'Glen Mar Golf and Country Club ', u'Diefenbunker - Canadas Cold War Museum ', u'Bytown Museum', u'Irish Hills Golf and Country Club ', u'Blue Bamboo Yoga ', u'Garden Of The Provinces and Territories'], [u'The Business Inn', u'Ottawa City Center', u'Niagara Falls City Center', u'Courtyard By Marriott Niagara Falls', u'Bird Kingdom', u'Niagara Falls'], [u'Courtyard By Marriott Niagara Falls', u'Skylon Tower', u'Buffalo Zoo', u'Buffalo And Erie County Naval And Military Park'], [u'Ontario Science Centre', u'Courtyard By Marriott Niagara Falls', u'Niagara Falls City Center', u'Toronto City Center', u'The Parkway Place Guesthouse'], [u'The Parkway Place Guesthouse']]",05 Oct 2016,"[u'Toronto', u'Toronto', u'Toronto', u'Toronto', u'Toronto', u'Kingston', u'Kingston', u'Montreal', u'Montreal', u'Montreal', u'Quebec', u'Quebec', u'Quebec', [u'Ottawa', u'Quebec'], u'Ottawa', u'Ottawa', u'Niagara Falls', [u'Buffalo', u'Niagara Falls'], u'Toronto', ' ']"
29 Aug 2016,,"[[u'Mosaicultures Internationales', u'Botanical Garden', u'The Olympic Park'], [u'Casino De Montreal', u'Old Montreal', u'Notre-dame Basilica', u'Chateau Ramezay Museum'], [u'Musee Des Beaux-arts De Montreal', u'La Citadelle', u'Three Monkeys', u'Montreals Underground City'], [u'Mont Royal Cemetery', u'Mount Royal', u'St Josephs Oratory Of Mount Royal'], [u'Le Village', u'Place Des Arts', u'Circuit Gilles Villeneuve', u'Les Bobards'], [u'Chateau Frontenac', u'Haute-ville', u'Parliament Building', u'La Citadelle', u'Fortifications Of Qu\xe9bec National Historic Site', u'Cathedral Of The Holy Trinity'], [u'Basilique Cathedrale - Notre-dame-de-quebec', u'Musee De La Civilisation', u'Place Royale', u'Morrin Centre'], [u'Hotel De Glace', u'Musee Du Fort', u'Choco Musee Erico', u'Musee National Des Beaux Arts Or Du Quebec', u'Musee Des Ursuline De Quebec', u'Quartier Du Petit Champlain'], [u'Battlefield Park ', u'Observatoire De La Capitale', u'Museum Of French America Or Musee De L\\ameriquefrancaise', u'Lower Town'], [u'Parc De La Chute Montmorency', u'Casino De Montreal', u'Terrasse Dufferin'], [u'Garden Of The Provinces and Territories', u'Peace Tower', u'Vincent Massey Park', u'Mooneys Bay Park', u'Midway Family Fun Park', u'TD Place Stadium'], [u'Osgoode Township Historical Society and Museum', u'The Meadows Golf and Country Club', u'Canadian Museum Of Nature', u'National Arts Centre', u'Notre Dame Basilica', u'Nepean Point', u'Ottawa River Parkway'], [u'Chapman MIlls Conservation Area', u'Manderley On The Green ', u'Richmond Centennial Golf Course ', u'Glen Mar Golf and Country Club ', u'Blue Bamboo Yoga ', u'Irish Hills Golf and Country Club ', u'Diefenbunker - Canadas Cold War Museum ', u'Loch March Golf and Country Club ', u'Canadian Tire Centre'], [u'Rideau Hall', u'National War Memorial', u'Rideau Canal', u'Lansdowne Park', u'Brewer Park', u'Watsons Mill ', u'Emerald Links Golf and Country Club'], [u'Boy Scout Memorial', u'Washington Monument', u'United States Holocaust Memorial Museum', u'Bureau Of Engraving And Printing', u'Smithsonian Castle', u'Hirshhorn Museum And Sculpture Garden'], [u'James A. Garfield Memorial', u'United States Capitol', u'Senate And House Office Buildings'], [u'Albert Einstein Memorial', u'Vietnam Womens Memorial', u'Lincoln Memorial', u'Vietnam Veterans Memorial', u'Memorial To The 56 Signers Of The Declaration Of Independence'], [u'White House', u'Executive Office Building']]",15 Sep 2016,"[u'Montreal', [u'Montreal', u'Quebec'], u'Montreal', u'Montreal', u'Montreal', u'Quebec', u'Quebec', u'Quebec', u'Quebec', u'Quebec', u'Ottawa', u'Ottawa', u'Ottawa', u'Ottawa', u'Washington D. C.', u'Washington D. C.', u'Washington D. C.', u'Washington D. C.']"
30 Aug 2015,,"[[u'Montreal Biodome', u'Botanical Garden'], [u'Toronto Eaton Centre', u'Royal Ontario Museum']]",31 Aug 2015,"Montreal,Toronto"
01 Oct 2015,,"[[u'Botanical Garden', u'Notre-dame Basilica'], [u'Old Montreal', u'Musee Des Beaux-arts De Montreal', u'La Citadelle'], [u'Mosaicultures Internationales', u'Mont Royal Cemetery'], [u'Lorchestre Symphonique De Montreal', u'Canadian Railway Museum', u'Belgo Building'], [u'Basilica Of St. John The Baptist', u'Pippy Park', u'Johnson Geo Centre', u'Cape Spear Lighthouse', u'Inn Of Olde Pub'], [u'East Coast Trail', u'Quidi Vidi Lake', u'Terry Fox Memorial', u'George Street', u'Memorial University Of Newfoundland Botanical Garden'], [u'Signal Hill', u'Bowring Park', u'The Rooms'], [u'Peak To Peak Gondola', u'Whistler Blackcomb'], [u'Whistler Activity And Information Center', u'Whistler Olympic Park', u'Squamish Lilwat Cultural Centre', u'Whistler Museum', u'Whistler Farmers Market'], [u'Brandywine Falls Provincial Park', u'Whistler Sliding Centre']]",10 Oct 2015,"Montreal,Montreal,Montreal,Montreal,St. Johns,St. Johns,St. Johns,Whistler,Whistler,Whistler"
01 Aug 2016,,"[[u'London Heathrow Airport', u'Toronto Airport', u'Toronto Eaton Centre'], [u'C N Tower', u'Casa Loma', u'Royal Ontario Museum', u'Centre Island'], [u'Distillery District', u'Toronto City Center', u'Niagara Falls City Center'], [u'Skylon Tower', u'Journey Behind The Falls', u'Niagara Falls'], [u'Niagara Parks Butterfly Conservatory', u'Niagara Falls City Center', u'Ottawa City Center'], [u'The Business Inn', u'Rideau Canal', u'Notre Dame Basilica', u'The Business Inn'], [u'The Business Inn', u'Diefenbunker - Canadas Cold War Museum ', u'Ottawa City Center', u'Quebec City Center', u'H\xf4tel Cofortel'], [u'H\xf4tel Cofortel', u'Basilique Cathedrale - Notre-dame-de-quebec', u'La Citadelle', u'Place Royale', u'Musee National Des Beaux Arts Or Du Quebec', u'H\xf4tel Cofortel'], [u'H\xf4tel Cofortel', u'Chateau Frontenac', u'Quebec City Center', u'Tadoussac City Center', u'Hotel Tadoussac', u'Parc Marin Du Saguenay\u2013saint-laurent', u'Hotel Tadoussac'], [u'Hotel Tadoussac', u'Marine Mammal Interpretation Centre', u'Chauvin Trading Post', u'Azimut Aventure Inc.', u'Grandes-bergeronnes Airport', u'Les Ecumeurs Du St-Laurent', u'Petite Chapelle De Tadoussac', u'Mer Et Monde Ecotours', u'Pointe-Noire Interpretation and Observation Centre', u'Hotel Tadoussac'], [u'Hotel Tadoussac', u'Tadoussac City Center', u'Montreal City Center', u'Hotel A2k', u'Musee Des Beaux-arts De Montreal', u'Hotel A2k'], [u'Hotel A2k', u'Mosaicultures Internationales', u'Botanical Garden', u'Hotel A2k'], [u'Hotel A2k', u'Notre-dame Basilica', u'La Citadelle', u'Montreal Airport', u'London Heathrow Airport'], [u'London Heathrow Airport', u'London Heathrow Airport']]",14 Aug 2016,"[u'Toronto', u'Toronto', u'Toronto', u'Niagara Falls', u'Niagara Falls', u'Ottawa', u'Ottawa', u'Quebec', [u'Tadoussac', u'Quebec', u'Rivi\xe8re-\xc9ternit\xe9'], [u'Baie-sainte-catherine', u'Grandes-bergeronnes', u'Tadoussac', u'Les Escoumins'], [u'Montreal', u'Tadoussac'], u'Montreal', u'Montreal', ' ']"
30 Oct 2016,,"[[u'Statue Of Liberty', u'Madison Square Garden', u'Ground Zero', u'Times Square'], [u'The Metropolitan Museum Of Art', u'Coney Island Cyclone', u'Rockefeller Center'], [u'Central Park', u'American Museum Of Natural History', u'Yankee Stadium'], [u'Ellis Island', u'Bronx Zoo', u'Museum Of Modern Art'], [u'Old Montreal', u'Montreals Underground City'], [u'Mount Royal', u'Botanical Garden'], [u'The Olympic Park', u'Le Village'], [u'Belgo Building', u'Mosaicultures Internationales', u'Place Des Arts', u'Les Bobards'], [u'Fort Rodd Hill And Fisgard Lighthouse', u'Vancouver Aquarium', u'Fisherman\\s Wharf', u'Craigdarroch Castle'], [u'Miniature World', u'Victoria Bug Zoo', u'Whistler Blackcombs Coca-Cola Tube Park'], [u'Butchart Gardens', u'Science World', u'Stanley Park', u'Granville Island'], [u'Grouse Mountain', u'Capilano Suspension Bridge', u'Big Bad John\\s', u'Jericho Beach', u'Museum Of Anthropology'], [u'Alaska Zoo', u'Kincaid Park'], [u'Point Woronzof', u'Alaska Native Heritage Center', u'Wells Fargo Alaska Heritage Museum', u'Alaska Law Enforcement Museum'], [u'Alaska Railroad Depot', u'Tony Knowles Coastal Trail'], [u'Alaska Botanical Garden', u'Potter Marsh', u'Alaska Aviation Heritage Museum', u'Anchorage Museum At Rasmuson Center'], [u'Woodland Park Zoo', u'Pike Place Market', u'Seattle Public Library', u'Space Needle'], [u'The Gum Wall', u'The Seattle Waterfront Or Central Waterfront', u'Seattle Aquarium', u'Benaroya Hall', u'Sky View Observatory'], [u'Bruce Lee Grave Site', u'Fremont Troll', u'Hiram M. Chittenden Locks', u'Klondike Gold Rush National Historical Park', u'Seattle Waterfall Garden'], [u'Centre For Wooden Boats', u'Seattle Great Wheel', u'Seattle Art Museum', u'Key Arena', u'Myrtle Edwards Park'], [u'Hollywood Cafe', u'Winchester Mystery House', u'Marin Headlands', u'The Walt Disney Family Museum'], [u'North Beach', u'The Tech Museum Of Innovation', u'Cathedral Basilica Of St. Joseph'], [u'San Francisco Cable Car Museum', u'California Academy Of Sciences', u'Ripleys Believe It Or Not', u'555 California Street'], [u'Adventuredome', u'Stratosphere Casino, Hotel And Tower', u'Criss Angel Mindfreak'], [u'Ethel M Chocolate Factory', u'Fremont Street', u'The Roller Coaster'], [u'Gregory Popovichs Comedy Pet Theater', u'High Roller', u'Mount Charleston'], [u'White House', u'Lincoln Memorial', u'National Air And Space Museum', u'National Gallery Of Art', u'Washington Monument'], [u'United States Capitol', u'National Museum Of Natural History', u'Fords Theatre', u'Iwo Jima Memorial'], [u'Pentagon', u'Washington National Cathedral', u'Library Of Congress', u'Thomas Jefferson Memorial']]",27 Nov 2016,"[u'New York City', u'New York City', u'New York City', u'New York City', u'Montreal', u'Montreal', u'Montreal', u'Montreal', [u'Vancouver', u'Victoria'], [u'Victoria', u'Whistler'], [u'Vancouver', u'Victoria'], [u'Vancouver', u'Victoria'], u'Anchorage', u'Anchorage', u'Anchorage', u'Anchorage', u'Seattle', u'Seattle', u'Seattle', u'Seattle', [u'San Jose', u'San Francisco'], [u'San Jose', u'San Francisco'], u'San Francisco', u'Las Vegas', u'Las Vegas', u'Las Vegas', u'Washington D. C.', u'Washington D. C.', u'Washington D. C.']"
15 Aug 2015,,"[[u'Old Montreal', u'Mosaicultures Internationales', u'St Josephs Oratory Of Mount Royal'], [u'Mount Royal', u'Notre-dame Basilica'], [u'Lorchestre Symphonique De Montreal', u'Mont Royal Cemetery', u'Place Des Arts'], [u'Montreal Biodome', u'Three Monkeys', u'La Citadelle'], [u'Montreals Underground City', u'Musee Pointe-a-calliere', u'Musee Des Beaux-arts De Montreal'], [u'La Citadelle', u'Musee Du Fort', u'Cathedral Of The Holy Trinity'], [u'Place Royale', u'Museum Of French America Or Musee De L\\ameriquefrancaise', u'Musee De La Civilisation'], [u'Basilique Cathedrale - Notre-dame-de-quebec', u'Fortifications Of Qu\xe9bec National Historic Site', u'Musee National Des Beaux Arts Or Du Quebec']]",22 Aug 2015,"Montreal,Montreal,Montreal,Montreal,Montreal,Quebec,Quebec,Quebec"
21 May 2016,,"[[u'Old Montreal'], [u'Mosaicultures Internationales', u'Chateau Ramezay Museum', u'Notre-dame Basilica'], [u'Lorchestre Symphonique De Montreal', u'Mont Royal Cemetery', u'Place Des Arts'], [u'Montreal Biodome', u'Botanical Garden'], [u'Belgo Building', u'Musee Des Beaux-arts De Montreal', u'La Citadelle'], [u'Musee Pointe-a-calliere', u'The Olympic Park']]",28 May 2016,"Montreal,Montreal,Montreal,Montreal,Montreal,Montreal"
22 Aug 2016,,"[[u'Dulles International Airport', u'Montreal Airport', u'Hotel Zero 1 Montreal', u'Circuit Gilles Villeneuve'], [u'Hotel Zero 1 Montreal', u'Mosaicultures Internationales', u'Botanical Garden', u'Le Village', u'Three Monkeys'], [u'Hotel Zero 1 Montreal', u'La Citadelle', u'Notre-dame Basilica', u'Place Des Arts', u'Les Bobards', u'Musee Des Beaux-arts De Montreal'], [u'Hotel Zero 1 Montreal', u'Mont Royal Cemetery', u'St Josephs Oratory Of Mount Royal', u'Belgo Building', u'Terrasse Dufferin'], [u'Hotel Zero 1 Montreal', u'Montreal, Qc', u'New York City, Ny', u'Holiday Inn Express - Wall Street'], [u'Holiday Inn Express - Wall Street', u'Liberty State Park', u'Ellis Island', u'Liberty Landing Marina', u'Statue Cruises', u'Central Railroad Of New Jersey Terminal', u'Empty Sky 9-11 Memorial', u'Pole Position Raceway'], [u'Holiday Inn Express - Wall Street', u'Empire State Building', u'Times Square', u'Museum Of Modern Art', u'The Metropolitan Museum Of Art', u'High Line', u'Grand Central Terminal', u'Central Park'], [u'Holiday Inn Express - Wall Street', u'New Jersey Colgate Clock', u'Barrow Mansion', u'Grace Church Van Vorst', u'Sail N Y C', u'Hudson And Manhattan Railroad Powerhouse', u'Newport Centre', u'Rockefeller Center', u'West Jet', u'Dane County Regional Airport']]",29 Aug 2016,"[[u'Dulles', u'Montreal'], u'Montreal', u'Montreal', [u'Montreal', u'Quebec'], ' ', [u'New York City', u'Jersey City'], u'New York City', [u'New York City', u'Madison', u'Jersey City']]"
09 Aug 2015,,"[[u'Bird Kingdom', u'Niagara Falls', u'7500 Lundys Ln', u'The Whirlpool Aero Car'], [u'Hockey Hall Of Fame', u'Distillery District', u'Centre Island'], [u'Toronto Zoo', u'C N Tower'], [u'Chinatown', u'Kensington Market', u'Royal Ontario Museum'], [u'Old Montreal', u'Chateau Ramezay Museum', u'Three Monkeys', u'Musee Des Beaux-arts De Montreal']]",13 Aug 2015,"Niagara Falls,Toronto,Toronto,Toronto,Montreal"
